jJ,Based on these change scores we computed the distance between the two jobs in the three-dimensional space and correlated with the averaged difficulty ratings.,1,0.45232337713241577,0.8515922711727272
1VE,"we conducted generalized linear mixed modelswith the individual as the unit of analysis, the ﬁxed eﬀect set as groupmembership, and the random eﬀect set as the pair that participantsconversed in.",1,0.46633338928222656,0.6942953431454545
G1O,"All analyses are based on linear mixed-eﬀects models with themovement indices of latency and average deviation entered separately asdependent variables. To test key research questions, analyses aregrouped into distinct sets based on whether conspiracy responses wereanswered as nonbeliefs or beliefs (for justiﬁcation, see section “Note onseparating belief and nonbelief responses”), and whether comparisonsare being made between partisan groups or within partisan groups.",1,0.5005040168762207,0.7587326298636363
XGZ,"An ANOVA omnibus test examining the effect of identity condition on collective action, followed by post-hoc comparisons between identity conditions.",0,0.382527619600296,0.4115722492454546
rvb,"A binary logistic regression with uncertainty condition, task construal, and their interaction entered as predictors and the task resumption rate as the dependent variable",0,0.45880764722824097,0.23514733321818185
rjb,"the data were first submitted to a multiple regression analysis in which stability (calculated from T1 and T2 data) was regressed on objective ambivalence and overall certainty (collected at T1), which were entered as predictors in the first step of the model, and the two-way interaction term was entered as a predictor of stability in the second step.  Attitude extremity (collected at T1) was entered in the analysis as a covariate.",0,0.4251599609851837,0.3887652256818182
ZEa,We conducted simple-effects tests based on our a priori hypotheses.,0,0.44859635829925537,0.3849048935181818
pz8,Average accuracy between Korean and American participants was compared using Student’s t test.,0,0.45022475719451904,0.5
ArY,Pearson correlations were used to test the existance of a relationship between RMA and fixation time,0,0.40269339084625244,0.5
V85,d prime scores were used as the dependent variable to compute a 2 (target race: Black or White) by 2 (eye-gaze: direct or averted) mixed-model ANOVA.,0,0.41663452982902527,0.2697852726454545
YbK,"our primary analysis involved conducting a multiple regression analysis to estimate the IPA-RS relation controlling for relationship length, age, and sex to rule out the possibility that these factors explained our findings.  Additionally, we controlled for participants’ own implicit self esteem (ISE) in all analyses to ensure that our findings distinctly reflected IPA.",0,0.46773576736450195,0.3097514166727273
rpq,"Paired-samples t-tests were used to test significant effects, with target age as the predictor variable and time at which participants indicated that the first emotion had completely disappeared from the face as the outcome variable.",1,0.3851308524608612,0.6009678756272727
Ow0,This is tested by conducting a one-way F tests for each response scale. An F test (One-way anova/t-test) is used to test whether reverse-coded scores on the current money management stress scale differ by positive/negative frame condition.,0,0.5126640200614929,0.4221259183818182
0b8,"Tested in the European Social Surveys 2002-2014 with a logistic regression estimating the effect of political ideology (measured continuously) on buying/boycotting behavior, adjusting for age, religion, gender, income, and education, with fixed effects for country.",1,0.43632107973098755,0.6367869311909092
l4J,"an ANOVA in which the dependent variable was wage rate ($ per hour), and the independent variables were the wage-elicitation procedure (MEL vs. TEL) and the perceived time scarcity (control vs. low vs. high).",0,0.4780917167663574,0.3612528637545454
5JE,"Tested by regressing desirability (alpha = .73) on clarity condition (contrast-coded where 1 = clear, and –1 = conflicted) and experimental condition (contrast-coded; 1 = bimodal, –1= unimodal), and their interaction.",0,0.4387461841106415,0.22411387350909093
d8p,A contrast analysis between single- and multi-serving food at the low processing capacity level (following an ANOVA on the measure of perceived product adequacy given condition (single- or multi-serve condition) and PC (low or high)),0,0.4196171164512634,0.4857409699636364
Q9m,"This was tested with a regression model in which materialism (success facet) was the dependent variable, parents’ materialism was a control variable, and material parenting practices (conditional material rewards at grades 3, 7, and 10 were the independent variables.",0,0.4878537654876709,0.5204074839
4mV,"A 3 (Country-related affect) x 2 (product origin: Japan vs. China) x 2 (strong vs. weak product description) between-subjects ANOVA of the evaluation index formed from participants’ ratings of a new camera product, where the effect of interest is the interaction between product origin and CRA.",0,0.4675421714782715,0.3276114624
BaDx,"Using Baron and Kenny’s (1986) four-step approach to mediation, cumulating in regressing participants’ gambling preferences on both social inclusion/exclusion condition and instrumentality index score",0,0.46066364645957947,0.2803480892090909
gw38,"An F test of the difference in model fit of a linear and a third-degree polynomial to the data from Study 1, with volume of soup served as the dependent variable and diameter ratio as the predictor.",0,0.2563570737838745,0.3971086889090909
jN32,"An ANOVA on Study 1a participants’ ratings of three romance movies with physical coldness (hot tea, cold tea) as an independent variable.",0,0.43947070837020874,0.18068097983636364
dDz8,An F test with tactile appeal of the lotion as the dependent variable and affective state as the between-subjects independent variable.,0,0.44033002853393555,0.32888083171818183
NNGV,"A regression over participants in the introjection (other-rating first) condition, of respondent’s attitudes (how much they like the product) on CNFU level, adoption level (that participant’s prediction of what percentage of other consumers would use the product), and their interaction.",0,0.4489979147911072,0.3315465764454545
egKl,"A between-subjects Poisson regression of participants at the Low level of progress, with progress type (earned, endowed) as the independent variable, and a dependent variable of log-transformed visit frequency, with a dummy count of 0.01 added to all data points prior to log-transforming.",0,0.43421471118927,0.522652290790909
1zb7,A two-sample t test with condition (ideal-first vs standard-only question) as the independent variable and likelihood of donating blood on the final question as the dependent variable,0,0.43473947048187256,0.3755441233818182
RGg7,"We analyzed participants’ continuous ratings of [eyewitness believability] using analyses of variance (ANOVAs), testing for main effects and all possible interactions of administration type, video-taped administration, and expert testimony, and found a main effect of the presence of the videotaped identification procedure.",1,0.508726954460144,0.7445726838363637
Ba9E,"A 2 (confirming feedback) by 3 (shift type: shift commit, shift revert, shift change) Chi-square test was conducted to see if participants who received confirming feedback were more likely to stay with the choices they shifted to when shown the photo array a second time.",1,0.5172281265258789,0.827416319790909
a8AB,"The coefficient for invoke versus waiver condition will be negative and statistically significant in a logistic regression with ""signature"" as the dependent variable. ",0,0.4781514108181,0.41270432754545455
zKJ1,a mixed ANOVA with negotiator (2: Dutch vs. German) as a between-subjects factor and perpetrator (2: Dutch vs. German) as a repeated measure.  The dependent variable was the total use of legitimizing strategies across negotiators.,0,0.4649665951728821,0.20781996790909094
25Yg,regression analyses controlling for age,1,0.5572599768638611,0.6720300966818179
K47e,"2 (PTP: Neg-PTP vs. No-PTP) X 2(deliberation: deliberating vs. nominal) loglinear ANOVA, which uses the test statistic chi-square instead of F. The dependent variable was the likelihood of rendering a guilty verdict.",1,0.5175879597663879,0.8146950920545456
a84D,based on a comparison of the mean of the social status measure across the levels of the dichotomous prison gang activity measure,1,0.5488261580467224,0.7591864576454544
gwpg,"using a logistic regression in which feedback, similarity, and the feedback-by-similarity interaction were specified as categorical predictors of identification accuracy",0,0.5307205319404602,0.3661587736363636
YBWN,using a two-way ANOVA with endorsement of force treatment as the dependent variable and type of mental health condition and substance abuse as the two factors along and the two-way interaction,1,0.5489811897277832,0.8354008153727274
zK4y,Cox proportional hazard model with general recidivism as the dependent variable and YLS/CMI scores as the main predictor. The model also included controls for age and disposition type.,1,0.5309858322143555,0.7321705285636363
WpON,"analyzing the ratings of the strength of the evidence against the defendant using a 2 X3 factorial ANOVA, with evidence strength (strong vs. weak) and confession (high-pressure, low-pressure, none) as between-subjects factors and estimating the interaction between them",1,0.49274277687072754,0.7592062185909092
PK5J,using receiver operating characteristic (ROC) analysis with re-arrest for any offense as the predicted outcome and the (DVSI-R) scores as the predictor,1,0.5191433429718018,0.8115919102181818
JYKk,"Tested the claim using ordered logistical regression. The dependent variable was the level of support for ouptatient commitment laws (OCLs).  The model included controls for basic socio-demographic measures, religious and political affiliation, knowledge of OCL, and having friends and family with mental illness.  The primary independent variables of interest were two continuous measures of “individualism versus egalitarianism"" and ""hierarchy versus communitarianism” and their interaction with a race/ethnic dummy variable (white versus non-white) ",0,0.5121394991874695,0.3675539341545455
rO4R,"A Procedural Justice (y/n) x Hierarchical Position (high/low) x Sense of Power (high,  low) ANOVA on the dependent variable formed by taking the difference of contributions in round 1 vs. round 2.",0,0.3446683883666992,0.3282817243545455
0RPb,"Ordinary least squares regression with organizational identification at time 2 as the dependent variable, with a fixed effect for  intrinsic motivation at time 1, controlling for recent earnings, total earnings and extrinsic motivation",1,0.5240805745124817,0.6531243129818182
WpWX,"A regression model of job search self-efficacy on the predictors of APGO (avoid-performance goal orientation), LGO (learning goal orientation), perceived incivility, the interactions between APGO x perceived incivility, and LGO x perceived incivility, and control variables for age, gender, race, prior work experience and trait negative affect. The model was fit using Model 8 of the SPSS macro, PROCESS (Hayes, 2012, 2013) that allowed us to test both direct and indirect effects of our mediation and first-stage moderated mediation models while conducting bootstrapped models that produced 95% bias corrected confidence interval (CI)estimates for these models. All continuous variables included in the analyses were standardized",0,0.41750696301460266,0.2169731952636364
zKGr,"Bivariate biometric analyses using the Cholesky decomposition model was used to decompose observed relationships into genetic and environmental components, testing whether occupational status and interpersonal conflict at work related to jobsatisfaction over time with genetic influences controlled for",1,0.4904870390892029,0.7626598926
RGqE,"We tested our hypotheses using hierarchical regression analyses of peer rated task performance (a standardized SOREMO composite of other group members’ ratings of one member ) on a series of predictors: We entered control variables (i.e., gender, language proficiency, international experience, work experience, cognitive ability, and BigFive personality) in the first step, response judgment in the second, and situational judgment in the third.",0,0.48563405871391296,0.4387662265272727
3OGW,"A regression model (Model 3) with individuals’ BMI as the dependent variable in a growth model (estimating the effect of time on BMI), with main effects for all predictors (key predictors of work hours, irregular shift (y/n) work responsibility, number of children, and spouse work hours, and controls for sex, age, and race/ethnicity), and, critically, the interaction between timepoint and the five key predictors.",0,0.4653486907482147,0.5084875534000001
DEmL,"Calculated the correlation coefficient (rho) between Extraversion and LGD and CA, respectively, from estimates in a metaanalytic dataset composed of effects sizes (averaging whenever more than one measure of a bivariate relationship was present in a paper), weighted by sample size and corrected for range restriction and attenuation due to predictor and criterion unreliability. 95% confidence intervals around these estimates allow for an interpretation of significantly different estimates.",1,0.46366581320762634,0.7853756876181817
PK3K,"Using employee organizational deviance as the dependent variable, calculating 95% bias corrected confidence intervals (CIs) for the conditional direct and indirect effects at various levels of the moderators, using the Hayes macro with 5,000 iterations, and conducting a moderated mediation analysis to examine the indirect effects (through supervisor abusive behaviors) of hostile climate perceptions conditional upon supervisor conscientiousness. ",0,0.47945183515548706,0.3477403031272728
8EeW,"Analyses were conducted at the team level, with productivity (indexed by clients’ rating of the team’s quality and quantity of work) as the dependent variable, and independent variables entered in a four step procedure; Step 1: Control variables (team size, task type, mean organizational tenure, polychroinicity mean, gender age and tenure diversity) Step 2: Standard deviation of polychronicity, Step 3: Main effects of STC (shred temporal cognition) and TMS (transactive memory systems), and Step 4: the two-way interactions between the standard deviation of polychronicty and each of STC and TMS. A simple slopes analysis was then used to test the relationships between polychronicity diversity and team performance at different levels of STC.",0,0.46087875962257385,0.2434103498090909
pYQ3,"We regressed branch-level empowerment climate on branch-level HPWS (high-performance work systems), controlling for bank type and branch size.",0,0.4672704339027405,0.3833612592363636
egX9,"Hierarchical linear modeling with post-shift negative affect as the dependent variable, indirect care task satisfaction and direct care task satisfaction as level 1 predictors, with pre-shift negative affect included as Level 1 covariates. At Level 2, the model included ratings of nurse-physician relationship quality, psychological resilience, and the two-way interactions between these two predictors and the two task satisfaction measures. The Level 1 predictors were group mean centered and the Level 2 predictors were grand mean centered. Finally, we examined the overlap in the 95% CIs around the standardized predictors for direct and indirect care satisfaction.",0,0.46591663360595703,0.3865092292454546
PKAw,"Multilevel modeling (employing SAS PROC MIXED) of creativity in a mixed model with help seeking as the major predictor variable, controlling for group as a random variable as well as gender, tenure, education, creative personality, status, and help received.  All variables were grand-mean centered.",1,0.46816661953926086,0.5344561226272727
AWmN,"Conducted a hierarchical multilevel fixed model lower level mediation with team performance as the dependent variable, team potency as the mediating variable, and three independent variables: goal and process clarity and servant leadership. All models included control variables for mean team tenure, team age, and organizational tenure, as well as dummy coding of the five banks to control for the effects of organizational membership on the dependent variables.",0,0.48080652952194214,0.3147367025818182
pYPj,"Hierarchical linear modeling of individual task performance within groups as the dependent variable, individual-focused transformational leadership (TFL) as the predictor, with individual-focused TFL estimated as a fixed Level 1 coefficient which was not allowed to vary across groups.",0,0.4591422379016876,0.3222489106454545
Ba3Q,"A second-order-factor latent growth modeling approach, where the second-order intercept factors of psychological contract breach, affective commitment (AC), and innovation-related behavior (IRB)\ were specified to be correlated. At the same time, the second-order slope factors of psychological contract breach, AC, and IRB were also specified to be correlated. In addition, the intercept and the slope for each of these three study variables were specified to be correlated. Next, each first-order latent factor was represented by its respective measurement items, and the error variances of those measurement items that were repeatedly used across time points were allowed to be correlated.",1,0.5041459798812866,0.5666138044181818
XvLK,"Hierarchical multiple regression of workplace deviant behaviors, entering control variables (age, gender, and tenure) at the first step, the main effects (e.g., self-esteem & contingent self-esteem) at the second step, and the two-way interaction at the third step. All lower order terms were standardized to reduce multicollinearity.",0,0.48861438035964966,0.3416184641181818
GeVd,"the full model is elaborated in Equation 3, where fixed effects GLS is used to regress attendance onto SBBE x brand age, as well as other predictors.",0,0.4737565815448761,0.4797343824999999
OkRb,A 2 (NOWOM: present vs. absent) × 2 (SBC: high vs. low) ANOVA of behavioral intentions toward the brand,0,0.4985507130622864,0.421133007609091
Geep,Mean difference tests comparing mean short-term abnormal stock returns between green marketing partnership and green technology partnership announcements,0,0.5182923674583435,0.4401514661909091
9YYy,"To test the hypothesis, CCICog and CCIAff, as well as three control variables (i.e., respondent’s gender, age, and income), were predictor variables in a regression model with consumer resistance to company repositioning as the outcome variable.",0,0.4934645891189575,0.4222524491727273
9YDa,"The hypothesis was tested using regression, where risky investment was regressed on participant age, gender, average grade, managerial level, presence of performance decline, presence of incentive pay, and the decline by incentive pay interaction.",1,0.5051912665367126,0.7777843499909091
w5QP,Structural path analysis were used to determine path coefficients of attitudinal loyalty and behavioral loyalty on word of mouth.  These coefficients were then compared using a Wald Chi-square test.,1,0.515389084815979,0.7119784176636363
dXvX,"The effect size metric selected for the meta-analysis is the correlation coefficient. For studies that reported other measures (e.g., Student’s t, mean differences), those measures were converted to correlation coefficients following common guidelines for meta-analysis. All correlations were adjusted for unreliability. When a study did not report the reliability or used a single-item measure, we used the mean reliability for that construct across all studies. The reliability-corrected correlations were transformed into z-values. We averaged these z-scores and weighted them by the inverse of their variance following a random effects perspective before reconverting the integrated results",0,0.5435572266578674,0.4564086422363636
yDyG,"We tested the hypotheses using structural equation modeling.  The predictors were the sponsor (dummy coded), sponsorship relationship fit, sponsor-sponsee similarity, and their interaction.  The outcome variable was participant intention to support the nonprofit, and the mediating variables were nonprofit clarity of positioning and the participant’s attitude toward the sponsorship | In Model B, in addition to estimating the main effects, we estimated a fit by similarity interaction on intent to support the nonprofit, through the mediator of clarity of positioning",0,0.502773106098175,0.3566587345090909
VvGD,"we used the standard event study methodology to estimate cumulative abnormal returns (CARs) on the announcement samples. Here, CARs are the measure for the announcement effects. We estimated cumulative abnormal returns on the joint announcement sample which corresponds to the total announcement effects. Following this, we estimated CARs on the samples of pure name changes and pure business restructuring in order to estimate the individual announcement effects. Following this, we compared the CARs from the joint sample with the CARs of the individual samples using a t-test.",0,0.5424533486366272,0.3149853457363636
WE7Z,"We used Corrado’s nonparametric rank method to assess statistical significance, using days leading up to and after sponsorship announcement as the predictor and abnormal stock returns as the outcome variable.",0,0.5363971590995789,0.4247426368818182
1VbB,The comparison of SUFees versus MUFees in terms of factors they considered to be important when choosing their initial purchase of the franchise unit was evaluated by MANOVA,1,0.5056933164596558,0.6320286554727271
Q1Ga,"We then tested the effects of exposure to the Adidas and Samsung sponsorships on the dependent variables (brand affect, brand trust, and brand loyalty) using a repeated measures analysis of variance (ANOVA) with one within-subject factor (before and after sponsorship) and one between-subjects factor (experimental versus control group)",0,0.4767976701259613,0.4846983275000001
vR3L,"hypotheses were tested using structural equation modeling.  To test H4, identity synergy predicted organizational identification",0,0.48647862672805786,0.4929853873272727
r8jd,"employed in a series of hierarchical regression analyses to estimate the path coefficients for the hypothesized relationships.  Centralization, Formalization, GNP per capita, and Subsidiary role were control variables.  Legal institutions, Competitive intensity, HQ market orientation, Identification with HQ, cultural distance, and additional two-way interactions were the predictor variables of market orientation implementation at the subsidiaries of global companies.",0,0.5196893215179443,0.4772336464818182
584w,"New product program (NPP) innovativeness was operationalized in three ways (NPP newness, NPP value, and NPP frequency).  Means for each cluster of companies were compared using ANOVA, followed by Duncan’s and Walter’s multiple-range posttest.",1,0.5096456408500671,0.6165439164000001
Dl8D,"To explore the nature of the relationship between each of the firm culture dimensions and outcomes and to test the hypotheses, several regression analyses were performed after controlling for customer type.  The outcome was business performance, and the predictors were the organizational culture variables of innovation, stability, people oriented, outcome oriented, detail oriented, team oriented, and their two way interactions with national culture (Japanese or American).",0,0.5158582925796509,0.3815940417090909
7YXJ,"we attended to variables at two levels of analysis: (1) the level-1 model that captures individual differences in brand evaluations, and (2) the level-2 model that differentiates one brand from another. In level 1, we addressed the question of whether PBF,CBO, and their interaction actually influence brand value for each brand across individual consumers. Level 2 models were used to specify differences in brands.",0,0.5066692233085632,0.3162551863545455
Nj8V,A 2 (employee behavior) x 2 (pseudo relevant information) x 2 (outcome dependency) ANOVA was performed on the difference scores of brand impression (before and after scenario),0,0.46624496579170227,0.4605502059000001
ze1L,A one-way ANOVA with the experimental condition (regret vs satisfaction) as the independent variable and the behavioral intent index (two measures of liklihood to purchase a ticket) as the dependent variable,0,0.5164448022842407,0.3754277737181818
xmjb,"random assignment to a conceptual trait priming condition using a subliminal design (pro-social content vs. neutral content) and by a regression (OLS) of the amount of charity contribution on the priming condition. The model also controlled for charity/session fixed effects, charity, subject personality and was estimated for the sub sample of subjects that were above the median on a universalism attitude measure",0,0.4759159982204437,0.4306399660090909
E2AP,"by regressing the choice of compensation scheme (tournament versus piece-rate) in Round 3 on two standardized cortisol levels - after the piece-rate performance in Round 1 and after the competition in Round 2.  A female dummy variable was also included along with an interaction between the female dummy and both cortisol measures.  For the female subsample, the joint significance of the cortisol effect from both measurement occasions was assessed using a Wald Chi-square test.",0,0.47559210658073425,0.3386731164363637
