pNr3,"Study 1 uses a retail shopping setting to test a 2 (orientation: agency vs. communion) x 2 (social presence: alone vs. accompanying friend) between-subjects experimental design, where the key dependent variable is amount spent on a package of batteries and orientation is operationalized as participants’ gender (males are agency-oriented; females are communion-oriented). In the friend condition, when participants entered the store aisle, a confederate they had met previously was standing next to the battery display. In the alone condition, no one else was present in the store aisle. The authors conducted regression analysis with amount spent as the dependent variable and the accompanying friend, participant’s gender, and their interaction term as the independent variables. They used contrast coding for both gender (1 if male, –1 if female) and friend (1 if with friend, –1 if alone). Following the discovery of a significant friend x gender interaction, the authors compare the amount males (agency-oriented participants) spent in the friend and alone conditions as a partial test of H1.",0,0.5086625814437866,0.4006231013
dza2,"we conducted separate multiple regressions for men and women in which motivation to resolve relationship problems was regressed onto mean-centered self-compassion scores, mean-centered conscientiousness scores, and their interaction.",0,0.4842192530632019,0.4078856569636363
K5KJ,"Multiple regression was used with the predictors Culture (honor vs nonhonor), Individual endorsement of violence and Situation (favor vs no favor to repay) predicting expended effort to return a lost disk.",0,0.4595147371292114,0.3464529721454545
Qkvm,"A chi-square analysis of decision quality (1 = hidden profile solved, 0 = hidden profile not solved) across the experimental conditions (homogeneous feedback, majority condition, minority condition, and control condition)",1,0.4667794406414032,0.6361910695727274
NOql,"The claim is tested using ordered logistic regression with data from the Netherlands Kinship Panel Study (N = 2,444). Parental interest are modeled separately for mothers and fathers. Paternal interest was the dependent variable and based on the child’s ordered responses to “Has [father’s/mother’s name] shown an interest in your personal life in the past 3 months?” Responses were coded as 0 = “not at all,” 1 = “once or twice,” 2 = “several times.” Educational similarity between parent (father or mother) and child is is a four-category variable at the parent-child dyad level, where dyads are characterized as 0 = “low–low,”; 1 = “parent high–child low,”; 2 = “parent low–child high,”; or 3 = “high–high.” In the regression models, dummy variables were created with “low-low” as the reference. The model also included a number of control variables that captured characteristics of the child including age, gender, health, and birth order. The test of the claim is based on the statistical significance of the coefficient for the ""high-high” dummy variable in the equations for the father-child dyads, as well as the pair-wise contrasts between it and the other dummy variables reflecting education dissimilarity (""high-low” and ""low-high”). For the purposes of the SCORE project, the contrast with the ‘high-low"" group will be the focal test. Statistical significance for each pair-wise contrast at an unspecified alpha level is denoted by superscripts in Table 3",0,0.5577784776687622,0.4757081564636364
J7Z2,"The claim is tested using data from the Fragile Families and Child Wellbeing Study (FFCW) to examine how parents’ relationship status affected their activation of financial support from kin. The dependent variables measured mothers’ receipt of financial support from kin among those reporting that financial assistance was available to them (‘‘activated support’’). The authors calculated activated financial support at each survey wave. The primary independent variable of interest in this paper, was the mother’s relationship status. The authors calculated relationship status for each survey wave, coding it as (1) married, (2) cohabiting(not married), (3) visiting (in a relationship, but not cohabiting), or (4) not in a romantic relationship. In order to examine the association between relationship status and activated kin support over time, the authors employed a multilevel, logistic regression - taking advantage of the hierarchical nature of the FFCW data (four postpartum waves nested within individuals). The authors defined Level 1 units as the measurement occasions and Level 2 units as individuals. The Level 1 model captured within-individual change in activated financial kin support. The Level 2 model for activated financial support from kin assumed that the intercept (β0i ) and change (β1i) parameters vary across individuals. The test of the selected claim is based on the coefficient for the dummy variable indicating that the mother is ""visiting (in a relationship, but not cohabiting)”. The reference category is cohabiting (not married). The authors also included explanatory variables capturing maternal, paternal, child, household, and family background characteristics previously found to be associated with kin support ",1,0.5587322115898132,0.8289389181727272
48bB,"The claim is tested with data from a sample of 1,725 firms for the years 2000–2009. The dependent variable of interest as evidence for the SCORE program is unanticipated stock returns, which the authors analyze within a system of equations with three other outcomes (idiosyncratic risk, CSR [corporate social responsibility], and marketing capability) using seemingly unrelated regression estimation. The analyses of these outcomes are themselves the second stage of a two-stage Heckman procedure to account for potential selection bias in the authors' sample (the inverse Mills ratio from the first stage is included as a regressor in the second stage). Among other predictors, the full model that provides evidence for the SCORE program includes a marketing capability x CSR interaction, both of which terms were mean-centered (see the Full Model for the stock return outcome variable in Table 5 for specification details).",0,0.5336431860923767,0.439896209109091
WGle,"The authors compare the predictions of atherosclerotic heart disease (AHD) mortality from regression models with different independent variables, by constructing the two target models and conducting conducted paired t tests comparing the sizes of the standardized residuals of county level predictions from these models. For the focal test, the first model was that which predicted county-level AHD from 10 traditional demographic (percentages of Black, Hispanic, married, and female residents), socioeconomic (income, education) and health (incidence of diabetes, obesity, smoking, and hypertension) variables. The second model was created using all of the Twitter language variables (All word, phrase, dictionary, and topic frequencies were independent variables and the AHD mortality rate was the dependent variable.)  Linear regression was used to fit the model with 10 predictors; regularized linear regression (ridge regression) was used to fit the language model, in which predictions were evaluated using a 10-fold cross-validation process that compared model predictions with out-of-sample data.",0,0.5473124980926514,0.1619348719563636
AybO,The critical dependent variable was the reaction time in a short-term memory task in which participants viewed the convex/concave display and reported which of two probe regions appeared in the initial displays. Data were submitted to a 2x2 repeated measures ANOVA with hand-containing region (convex vs. concave) and region probed (convex vs. concave) as factors,0,0.504473865032196,0.28533779022727274
W7z2,"The claim is tested with data on consumers’ store price perceptions, collected semiannually, over a period of four years from 2002 to 2005. Each survey wave was conducted during one week, during which a random subsample of panelists were asked to judge the overall price level (along with other characteristics) of the stores they visited in that week. In addition to store price beliefs, the survey collected panel members’ perceptions on other image components of the stores. Surveys were conducted in weeks 16 and 40 of every year, with an extra survey wave in week 5 of 2004. For the same panel members and in the same time period, the authors have scanner panel data on spending at visited stores for all 18 major grocery retail chains in the Netherlands. The authors estimate the impact of a range of predictors on SPI [store price image] using a Bayesian framework that models mean store price perceptions using a weighted average of previous store price beliefs and new price information, and they separate their models by store type (traditional supermarkets are the focal model for the SCORE claim). The dependent variable is the (log of the) precision of the price signals; a positive sign points to a higher effect of category prices on SPI, whereas a negative sign implies a lower impact. Given the double-log specification, the estimates are interpretable as elasticities indicating the relative importance of the category characteristics for SPI learning. The predictor of interest as evidence for the SCORE claim is expensiveness (average price of a typical pack in the category across all stores of the traditional supermarket format, weeks, and households) (see Table 6 for the full list of model terms).",0,0.538100004196167,0.430669792409091
EKpX,"The claim is tested with a 2 (measured self-construal: independent vs. interdependent) × 2 (type of experience: positive outcome, negative process vs. positive process, negative outcome) × 2 (consumer role: participant vs. spectator) between-subjects full factorial design, where participants were asked to recall a sports game they either participated in or were spectators of. The authors conducted a 2 (self-construal) × 2 (type of experience) × 2 (consumer role) analysis of variance (ANOVA) on overall experience consumption evaluations. Following the discovery of both a significant three-way interaction and a significant two-way interaction between self-construal and type of experience for spectators, the authors contrasted independents' and interdependents' evaluations in the positive outcome/negative process condition for spectators.",0,0.42079222202301025,0.33678422605454544
VGym,"The claim is tested with time-series cross-sectional data from International Data Corporation’s (IDC) Processor Installation Census by modeling a system of equations in which sales (Equation 3c), price (Equation 3a), and new product introductions (Equation 3b) are jointly endogenous. The authors split CNEWPRODUCTS [average competitive new product introductions faced by firm i in market m at time t], MMC [firm i's multimarket contact in market m at time t], and CPRICE [average competitive price faced by firm i in market m at time t] into the separate cases associated with increases and decreases in competitive price and new product introductions. In conjunction with a positive and significant effect of CNEWPRODUCTS_increase, the claim is tested with the coefficient on the interaction of the CNEWPRODUCTS_increase and MMC_increase terms, with the dependent variable of number of firm i’s new product introductions in market m at time t (Equation 3b) (see Equations 3-6 and Model 3 of the New Product Introductions models in Table 3 for specification details).",1,0.5312404632568359,0.5465309124545454
aaZD,"The study employed a within-subject design with one factor: the number of people behind versus ahead of a person in a queue. An experimenter sampled individual participants standing in the queue by asking them to complete a short survey while waiting in line. Meanwhile, another experimenter unobtrusively recorded the number of people standing behind and ahead of each surveyed participant. To measure participants’ evaluation of their meal, we asked them to rate the extent to which they expected to enjoy the sandwich they were about to purchase (seven-point scale: 1 = “not at all,” and 7 = “very much”). The claim is tested with a regression of the value measure on the number of people behind and ahead of participants.",0,0.44473135471343994,0.2970305228454545
YyPK,"Eye movement data were analyzed by examining mean gaze duration and fixation frequency per trial per RegionOf Interest (ROI) (4 equally sized ROIs (160 by300 pixels) centered on each word. The eye movement analysis was performed for experimental trials only (40 trials), in which the critical ROI was compared to the three control ROIs which were averaged together and values are reported per trial. Mean gaze duration (sum of fixation dwell times per trial) was analyzed using a repeated-measures ANOVA with word status (critical versus control) as the within-subject factor and group (English control versus Chinese–English bilinguals) as the between-subject factor.",0,0.48542940616607666,0.4754580158818181
Jvqe,"Participants’ proportion of correctly identified auditory tokens was computed for each condition (Auditory-only, Audiovisual congruent, and Audiovisual incongruent) was submitted to a MANOVA for repeated measures with Modality as within-subject factor and Condition (Speech; Sine-wave speech (SWS), speech mode; SWS, non speech mode; SWS speech mode with numerical responses) as a between-subject variable. A post-hoc t test compared performance in the incongruent-AV condition between the two main SWS conditions.",0,0.5168316960334778,0.3191570408
Rjp9,"The claim is tested with an original panel data set for city-level administrations in China between 2000 and 2011. The author uses a fixed effects model with a  dependent variable of economic performance (measured by GDP growth; set to t + 2 to allow a time lapse for local officials' effort to translate into economic outcomes). The key independent variable -- connected to provincial secretary -- is a binary indicator that takes the value of 1 if either the city secretary or the mayor is connected to the provincial secretary. City fixed effects capture the time-invariant heterogeneity across cities, and the year fixed effects are allowed to vary arbitrarily by province in order to absorb any province-specific economic or political shocks. The author also includes the following time-varying economic and leadership covariates: the levels of Log GDP, GDP Growth, Log Population, and Log Fixed Asset Investment, all measured in the final years of the city secretary’s and the mayor’s predecessors’ terms; Net Transfer, which is the difference between fiscal expenditure and revenue at t + 1; a set of standard demographics, such as Age, Gender, and College Education, for both the city secretary and the mayor; and controls for city leaders' tenure length. The coefficient of interest for testing the claim is on the term for 'connected to provincial secretary' in the third model of Table 1.",1,0.584368109703064,0.6342005291363636
3zRW,"The claim is tested with data on incidents of reorganization-related violence that resulted in injuries or deaths between January 26, 1950, when the Indian constitution came into effect, and November 1, 1956, when the State Reorganisation Act came into effect. The author estimates a multinomial logistic regression of reorgnization outcomes, with a dependent variable taking on three levels (an enclave where statehood was achieved peacefully; violence occurred possibly followed by statehood; no violence and no statehood occurred [omitted category]). The predictors include linear and squared terms for relative political importance -- measured as the ratio of Congress representation of opponents of statehood to the Congress representation of proponents (logged) -- as well as additional covariates specified in Model 1 of Table 5. In conjunction with the positive coefficient on logged relative political importance as a predictor of the violence outcome, the hypothesized non-monotonic relationship is tested with the coefficient on the squared term for logged relative political importance.",0,0.5469582676887512,0.2871031305272727
Vxd5,"The claim is tested with data on earmarks which were included in the House versions of the fiscal year 2008 Appropriations bills. The author divides the earmarks from the eight spending bills into categories on the basis of which bureaucratic division the funds for the earmarks are taken out of. The evidence for the claim used by the SCORE program comes from the Department of Defense appropriations (one of 17 categories included in the study). The dependent variable -- the number of earmarks each House member receives -- is regressed on three demand indicators (number of military installations in the district, number of major military installations in the district, percent of the population in the military [noncivilian] workforce), a dummy variable indicating whether the representative is a member of the standing committee which oversees the particular bureaucratic division, and additional indicators related to intrachamber factors. The specific effect of interest for testing the claim for the SCORE program is the number of military installations in the district.",1,0.5683081746101379,0.6039049699454545
AxQ1,"The claim is tested with data from a survey of land-use and transportation stakeholders in five study regions from March 2006 to June 2007. The survey population consisted of participants in the respective collaborative process, all stakeholders in the region identified as participants in Environmental Impact Statements in the California Environmental Quality Act database, and all planning staff/elected officials from city and county governments within the region. To test the EG [ecology of games] prediction, the authors estimate fixed effects random intercept regression models with individual-level cooperative attitudes and behaviors as the dependent variables and measures of participation in the collaborative institutions and other policy games as the main independent variables. Interaction effects between collaborative policy participation and traditional policy participation are the main theoretical focus of these models, because they show how the marginal effect of participation in the collaborative institution is conditional on participation in the other games. The ecology of games hypothesis predicts a negative interaction. The dependent variable used as evidence of the claim for the SCORE program is cooperative implementation (modeled in the first column of Table 3). The coefficient of interest is on the interaction of the traditional policy process and collaborative institution terms.",0,0.567662239074707,0.3424702000454545
G85O,"The claim is tested by analyzing the sample of regime-years from a larger dataset covering a total of 158 regimes and 2,132 regime-years where regime breakdown occurred (107 instances of regime breakdown, 54 of which were followed by electoral democracies). The dependent variable of 1 in a given year means that the regime experienced breakdown and was followed by three years of electoral democracy within the next four years. It is modeled in a logistic regression as a function of authoritarian regime classification (fully closed authoritarian [omitted category], competitive authoritarian, and hegemonic authoritarian); Geddes's regime types (military, military-personalist, personalist [omitted category], single-party hybrid, single-party, military/personalist/single-party, monarchy); and additional covariates specified in Model 4 of Table 3. The coefficient of interest as evidence for the SCORE program is on the competitive authoritarian indicator.",0,0.5745988488197327,0.2991379368727273
EJWP,"Using data on six cohorts of public high school twelfth-graders from 15 Florida counties who graduated from high school between 1996 and 2002, the earnings effects of the marginal college admission are tested using a fuzzy regression discontinuity design that compares outcomes for students with grades just below the grade cutoff for FIU [Florida International University] admission to outcomes for students with grades just above the cutoff. The dependent variable in the model supplying evidence for the SCORE program (Instrumental variables estimates from the main model in Table 5) is average quarterly earnings in 2005 dollars. This main specification uses observations within .3 grade points on either side of the threshold and controls for a second-degree polynomial in distance from the cutoff.",0,0.5505561232566833,0.3590609718454545
E22r,We examined whether the relationship between promotion focus and hunting orientation is stronger than that between prevention focus and hunting orientation (H1a) by imposing two constraints to the model and using a Wald test.,0,0.49888110160827637,0.33639266953636365
b4Kk,"we averaged their judgments across participants to create a mean score for each target, and compared the photo condition (Nobel laureate vs. celebrity mug shot) via t test",1,0.5064936876296997,0.8418078038090908
wQR4,"The claim is tested by integrating family and child data from the Early Childhood Longitudinal Study–Birth Cohort with contextual data from the census and examining associations among maternal employment, aspects of communities related to child-care supply and demand, and the early care and education arrangements of 4 year olds in Mexican-origin, Black, and White families. In particular, multinomial logistic regression models were estimated to predict children’s child-care arrangements. The reference category was any exposure to formal child-care options that were likely to involve early childhood education components, and the alternative categories were relative care or non relative care only and parent care only. This multi-category outcome was regressed on maternal employment and covariates, race/ethnicity and maternal employment interactions, focal community-level variables and maternal employment interactions, focal community-level variables and race/ethnicity interactions, and then all two- and three-way interactions among maternal employment, community-level variables, and race/ethnicity. The focal parameter in this regression model is the coefficient on the two-way interaction between the maternal Mexican origin dummy variable (reference was white ethnicity ) and the zip code level female unemployment rate in the equation comparing “relative or non relative care” to “early childhood education” (Table 4, Model 1, first column)",0,0.5548843741416931,0.4021774418454545
J71L,"The claim is tested using monthly surveys completed by mothers over a 2-year period after filing for divorce.  The authors examined changes in intercepts and slopes of dating status and transitions for maternal well-being while also testing the effects of relationship quality.  For the purposes of the SCORE project, the test of the claim is based on the coefficient for “Relationship Quality” in Table 2 and under the column labeled “Hypothesis 2”.   The dependent variable is negative affect.",1,0.5657867789268494,0.7892486665727272
7lmp,"The claim is tested using National Longitudinal Survey of Youth (NLSY) 1979 (NLSY79) and the linked Young Adults files. Of the 6,283 NLSY women in the original cohort, women were eligible for the analytic sample if they ever reported having children. Using STATA SE 13 statistical software (Stata-Corp LP, College Station, TX), ordinary least squares (OLS)regression models were performed. Depression. The dependent variable was adolescent self-reported depressive symptoms, assessed using the Center for Epidemiological Studies Depression ScaleShort Form (CES-D SF; Radloff, 1991). Father residential patterns, the primary independent variable of interest, were based on adolescent’s experiences of their mother’s romantic relationships and unions from the child’s birth to age 18 years. A set of adolescent and mother characteristics were incorporated into the models as covariates to reflect selection factors that might be a cause or consequence of a mother’s union stability and biological father’s residential patterns as well the adolescent’s depressive symptoms. The focal coefficient in the OLS regression model is on the dummy variable for “boomerang father” (i.e. a biological father exiting and entering the home because of breaking up and re-partnering with an adolescent’s mother).",0,0.5547459721565247,0.32113690263636363
VjeV,"The claim is tested using data from the Flourishing Families Study, an ongoing, longitudinal study of families with adolescents (see http://ﬂourishingfamilies.byu.edu/). The sample consists of 500 families (147 single parent, 348 two parent) with a child between the ages of 10 and 14 (M = 11, SD = 0.96; 49.8%male) at Wave 1. For this study, the authors focused on two-parent households. Using Mplus 6.12 (Muthén & Muthén, 2010), the authors employed the relatively recent method of exploratory structural equation modeling (ESEM) to test factorial invariance. In essence, this method differs from the more common confirmatory factor analysis (CFA) in that it has the ﬂexibility of EFA (including rotated solutions) along with the ability to impose model constraints to test hypotheses regarding factorial invariance. The selected claim relates to factorial invariance across the gender of a child reporter. The claim is tested using chi-square difference tests to determine whether imposing constraints representing strong measurement invariance decreased model fit relative to weak measurement invariance",0,0.50846266746521,0.3628449190727272
