zKgY,"The claim is tested by comparing the change in respondents' opinions about allowing foreign investors to own greater shares of U.S. airlines that's produced by reading a positively framed article versus a negatively framed article, when the experiment is administered through YouGov (national sample) versus being administered through MTurk (convenience sample).",0,0.4954383373260498,0.3993813429545454
9xZY,"The claim is tested with an OLS regression analysis of the determinants of children's nutritional status. The dependent variable is height-for-age Z-scores (HAZ scores). The independent variable of interest is the PCA [principle components analysis] asset index, which is a measure of women's asset ownership (see the HAZ Scores model in Table 2 for details of the full model).",0,0.570552408695221,0.3815904924545455
JK7Q,"Logistic regression models were used to model subjective sleep quality as a dichotomous outcome as a function of reports of SES discrimination. Models were adjusted for age, gender (Step 1), reports of racial and gender discrimination (Step 2), BMI [body mass index], perceived stress, financial stress (Step 3), and depressive symptoms (Step 4). In addition to those covariates, education was adjusted for in race-stratified models. An alpha level of 0.05 was used.",0,0.5382772088050842,0.30207616703636364
wWZ7,Evidence for the finding comes from a fixed effects model where the key explanatory variable GROWTH is the annual percentage change in per capita GDP and the dependent variable is the natural log of migration for country j in year t. The focal specification (Column 4 in Table 4) allows for country-specific time trends. The focal term selected to provide evidence is Growth (t - 1).,0,0.5595582127571106,0.3888913584727272
4zev,"Evidence for the finding comes from a mixed effect model (PROC MIXED) that was used to run linear regression. Socio-demographic variables, including age, sex, and socioeconomic status (SES), were controlled for. The outcome measure in the analysis selected for the SCORE program is children’s psychological symptoms (self-reported); Goodman’s Strengths and Difficulties Questionnaire (SDQ) was used to assess level of psychological symptoms. The analysis compares pre- versus post-intervention assessment (see the right-side columns of Table 3 for details).",1,0.4949275851249695,0.8293104146363635
qVDw,"Evidence for the finding comes from estimating the regression specified in Equation 1, where the dependent variable is the natural logarithm of the mortality rate for age group a in province p in year t. The term of interest is unemployment rate, which proxies for economic conditions. In Table 3, the authors consider estimates for each five year age group. The age group selected for the SCORE program is 30-34, and the analysis selected includes the province-specific trend in the estimating equation (see the second column of Table 3 for details).",0,0.5613514184951782,0.32452572391818185
kjg2,"The relationships between multiple risk behaviors and suicidal ideation and behavior were analyzed using multivariate logistic regression in which respondents with zero risk behaviors were used as the reference group. Odds ratios with 95% confidence intervals were calculated for each gradient in the cumulative risk behavior scale. The analysis selected for the SCORE program uses the Jewish Israeli sample, and relies on the total sample (odds ratio were adjusted for gender). The outcome selected is suicide ideation, and the gradient selected is 4 health risk behaviors (see Table 4 for details).",1,0.5310134291648865,0.8302758516636363
pB7j,"The associations of childhood SES [socio-economic status] with disorder severity were investigated using logistic regression models that were estimated among respondents with an episode of each focal disorder in the 12 months prior to the survey to predict probability of being classified as ‘severe’ on any of the four subscales of the SDS [Sheehan Disability Scales]. The results are contained in Table 4. The analysis selected for the SCORE program included additional covariates for the 11 CAs [childhood adversities], and the subscale selected is mood (see the 'any mood' column in Table 4 for details).",0,0.5405312776565552,0.3781883311090909
E8zN,"Logistic regression was used to estimate the association between each stigma component and use of the accurate and most common labels for each vignette whilst controlling for socio-demographic factors. Univariate binary logistic regression analyses examined the association between each of the predictor variables and each of the stigma components. Multipredictor binary logistic regression analyses were then used to examine which of the predictor variables remained significant in their association with each of the stigma outcome variables taking into account possible confounding effects. Each model included use/non-use of the five most common labels elicited by the vignette including the accurate label, and socio-demographic variables. Adjusted odds ratios from the logistic regression analyses are shown in Table 3 according to vignette type. The stigma outcome variable selected for the SCORE analysis is ""weak not sick,"" and the label selected as a predictor is depression (for the depression vignette).",1,0.5506543517112732,0.7801741033090909
POdb,"The authors created a series of cumulative binomial regression models to predict all-cause mortality, mortality from ischemic heart disease and mortality from other cardiovascular diseases with the original loneliness variable. They used Generalized Estimating Equations (GEE) applied to a person-years version of the survey dataset to produce the binomial regression models. The focal model (Model 1 in Table 2) analyzes all-cause mortality, and the specific predictor of interest is 'Often lonely' (see Model 1 in Table 2 for details).",1,0.5471416711807251,0.8346979829545454
5vDm,"The claim was tested in part by regressing student engagement on the main effects of three types of teaching practice (connective instruction, academic rigor, and lively teaching), using a hierarchical structure such that each Level 1 student by class case was nested within a cross-classified Level 2 that consisted of both students and classes. The equation on p. 376 gives the specification for the analysis, and the focal statistic is the effect of connective instruction in Model D, which controlled for students’ feeling of belonging among peers in a particular class, and for student level variables including grade level and gender,  and the class-level control of subject.",0,0.5662537813186646,0.4104580100181818
BlNQ,"OLS estimates. The independent variable equals 1 for a next-youngest sister and 0 for a next-youngest brother. The dependent variable considered in Table VIII is “In School”, column (4).",0,0.5579515695571899,0.5157458213
EZej,"The authors' specifications utilize a panel, ordinary least squares (OLS), framework with both country- and year-fixed effects. Table 2 reports the results of the effect of lagged terrorism incidence on the female labor force participation rate, as covariates are introduced into the fixed effects specifications. The specification selected is in column 5, and the focal term is terrorist attacks (t - 1).",0,0.5464709997177124,0.4660729300636364
jRbQ,"The data to test the hypothesis are directly available from COIL [Continent of International Law]; the number of participants is logged. The dependent variables are the two measures for contract incompleteness, difficulty and detail, described earlier in the paper; for the selected analysis, the difficulty measure is used. Since the dependent variable is continuous, a linear regression is used (see the top panel of Table 5 for details).",1,0.5588869452476501,0.7985463001545455
OylL,The paper considers nine different indicators of well-being. Table V provides regressions of each of these indicators on log national accounts GDP per capita and log household survey mean income on their own (Panel A).  The dependent variable is the negative of the log of the fertility rate and the independent variable is  log GDP per capita.,1,0.5540585517883301,0.8210310487727274
OygL,"The paper estimates equation (1) using ordinary least squares (OLS) regressions. The main explanatory variable is subscriber density, “Subs. density”. Table III presents the main OLS results. The portion selected is Column (1) of Table III. The dependent variable is the log city growth, 1750-1850.",0,0.5843368172645569,0.4512753385818182
9wkl,"Formal statistical inference are conducted in Table V. In Column (1) the paper regresses CAR(0,24) on a dummy for whether the union won the election. CAR corresponds to event i between months T1 and T2. The dependent variable is ""CAR(0,24)” and the independent variable is “Union Victory”.",1,0.5876287817955017,0.801121171281818
VLVA,"Table IV reports the coefficients from estimating equation (2). Poisson Regression: Impact of Deep Discounts on Post-test Orders. [Portion Selected, Table IV Column (1)]",1,0.5837699174880981,0.6614973742636363
2vB7,"Regression discontinuity framework. All columns in Table IV present RD coefficient estimates where each fiscal policy outcome was regressed on an indicator for Democratic victory in election t interacted with each of the three mechanisms that might explain the lack of partisanship at the local level, and other controls as described in equation (3). The dependent variable selected from Table IV is “Total revenues”.",0,0.5683756470680237,0.3715097063636364
V5dV,"Table 6 presents results from estimating GED Impact on Postsecondary Enrollment. Dependent variable selected is “Women Enrollment”. Focal independent variable is “Quarters since 1st GED test = 1”. Column 3, Row 1 of Table 6.",1,0.5343940258026123,0.8210313722363636
q8DZ,"Table 2 reports household fixed-effect estimates of specification (2 ) for four combinations of income and consumption. The dependent variable is consumption-income gap. In Table 2, the selected dependent variable “ln C1 - ln Y1” (Column 1). The focal independent variable is “After-reform trend (2001 = 1)”.",1,0.5659764409065247,0.7870110314727273
GOAw,"The paper follow BGH in conducting a pooled analysis using all person-quarter observations in the seven quarters following random assignment. Table 4 shows the probability of earnings / participation states. Adjusted probabilities are computed via propensity score reweighing. Standard errors computed using 1,000 block bootstrap replications (resampling at case levels). In Table 4, portion selected is “Overall - adjusted“ (Difference between Jobs First and AFDC) and Pr(State = 1n)”, where 1 indicates earnings below 3 times the monthly FPL and n indicates welfare nonparticipation throughout the quarter.",1,0.6274248361587524,0.8175704040272728
4ZGV,"Table III, Panel A, Specification (1) presents the results of regressions of activity dummy on various variables. The focal independent variable is “Labor income”.",1,0.5943230390548706,0.8107935473272728
8VXd,The paper performs a regression of monthly changes in the estimate marginal tax rate on the indicated explanatory variable in Table V. The focal independent variable is “S&P 500 Return”.,1,0.5568833351135254,0.5600628696090909
5Ebl,"The methodology to construct momentum profits is adapted from the “6-1-6” strategy in Jegadeesh and Titman (1993). The dependent variable is momentum profits. The independent variable is a firm with high EDF score and low R&D expenditure. In Panel B of Table IV, this is “Low” for “W-L” (raw momentum profits) under the heading “High EDF”.",1,0.5747471451759338,0.7689867696909091
AYQG,"In Table 1, the authors report results from four predictive models of gubernatorial vote choice in Argentina and Mexico. Their theoretical perspective entails an interactive relationship between subnational regime type and performance evaluations, wherein such considerations will be more strongly correlated with prospective vote choice in multiparty contexts than in dominant-party states or provinces. The selected analysis is Model 1 in Table 1, and the focal term is 'Dominant party × Sociotropic' (an individual’s “sociotropic” evaluation of the economy — that is, how she views the larger national economic picture, independent of her own personal situation) (see Model 1 in Table 1 for details).",0,0.5596084594726562,0.3624290250090909
aBp3,"The authors use the Cox proportional hazards survival model to assess the effect of indicators of autocratic linkage on autocratic regime survival. Table 1 presents the results of six Cox models employing in turn the trade, migration, and diplomatic exchange indicators of autocratic linkage in two variants. All models include the fourth linkage indicator, autocratic proximity (or rather, autocratic distance). In the selected analysis, found in the 'Trade (mean)' column of Table 1, the linkage is trade, using the average variant (see the 'Trade (mean)' column of Table 1 for details).",1,0.55488121509552,0.5433134607727272
O01m,"Evidence is found from estimating Model 1, which traces the long-run changes across about 40 years of DC [Democrazia Cristiana; Christian Democracy] vote. The model links modernization and secularization to the DC vote via the directed relationships or paths indicated by the arrows. The focal path is from modernization to DC 1953-1992 Slope (see Model 1 and Table 1 for details of the full model).",1,0.5523144006729126,0.7594470572363637
PDXb,"Table 4 considers the policy measures in the context of multilevel regression, with both individual- and context-level controls. The outcome measure for the selected analysis is the relative priority respondents place on country ancestry, as an “ascribed” definition of the national community. The selected analysis considers all three policy measures at once. The measure selected to test the claim is social spending (see the 'country ancestry' column of Panel B of Table 4 for details).",0,0.5603883862495422,0.5192915494909092
JrLy,We conducted 2 (gender: males vs. females)  by 2 (policy type: employment equity (EE) policy vs. environmental policy) analyses of variance (ANOVAs) on the overall self-image measure,0,0.4980146586894989,0.2680932997181818
dNNp,"regression models were conducted, using facial appearance and personality traits to predict leadership emergence",0,0.36327826976776123,0.2193006190636364
GQvr,"We first tested the functional form of growth (e.g., linear or quadratic) for both the binary dichotomous and continuous indicator parts separately without predictors or covariates. we then examined an overall model combining the two components. Lastly, we incorporated the various predictors into the models to account for variance in latent growth factors in order to test our hypotheses.",0,0.5310105085372925,0.3769085899818181
pGDj,"The authors test the selected claim using a fixed effects model.  The model is described in equation 1 and can also be gleaned from Table 4, Model 1.  The dependent variable is changes in ideal family size (IFS).  The focal independent variable is “New serious partner”.",0,0.5349441766738892,0.3806666717
xgxj,Table 2 presents the main results for equation (1). Total effects for men and women hired in years four or later are presented in Panel B.  The outcome is an indicator variable equal to one if the individual becomes a tenured associate professor at the policy university and zero otherwise. The focal independent variable is “Men GNCS”. Column 1 in Table 2 is selected.,0,0.5878134965896606,0.5220328504454544
9m4l,"The dependent variable in this analysis is a simple dichotomous measure of whether an appointee is affiliated with a government party or not. The central explanatory variable is Gilardi’s index of formal agency independence. Since the analysis focuses on appointments of top-level personnel, a simple average of the two component indices A and B which capture features of the appointment and dismissal process of agency managers is used. Table 2 presents two hierarchical mixed-effects logistic regression models with appointees nested in agencies and agencies nested in countries (model I) or regulatory domains (model II); the selected analysis is model I (see model I in Table 2 for details).",0,0.5650782585144043,0.4801830458636364
E1KN,"The sum of the number of practices from a list that were implemented in each organization constitutes the measure of innovation adoption in that organization. ""Pro-innovation attitude"" is a composite measure the authors derived by computing the mean of the manager’s responses to six items in the RG [reinventing government] survey that reflect his/her attitude favoring competition and entrepreneurship in public services. The authors conducted hierarchical regression analyses entering control variables, innovation characteristics, and managers’ demographic and personal characteristics, respectively (table 2). Model 6 is selected, and the focal term is 'pro-innovation attitude' (see model 6 in table 2 for details).",1,0.5533118844032288,0.7616514049909091
WjyZ,"Longitudinal multilevel models were used to analyze the effect of the intervention for each outcome. For the focal model (outcome variable = Functionality appreciation in Table 2), the final model specification included the predictors time, time^2, group, and their interaction, as well as the relevant Pretest measure as a grand-mean centered covariate.",1,0.5469089150428772,0.7126108599818182
1B5E,"The author follows a strategy that regresses a series of attitudinal and behavioral measures on the individual-level measures of the complexity and substantive content of democratic conceptualizations. In the 'Voting' column of Table 4, the author presents binomial logit estimates. The dependent variable is a measure of voting behavior. The focal independent variable is conceptual complexity, which ranges from 0 (if the respondent offered no definition of democracy) to 3 (if the respondent presented three definitions corresponding to three distinct meanings) (see the 'Voting' column of Table 4 for details).",0,0.5641523599624634,0.5099746003818182
qY4z,"The authors ran separate logistic regressions for all Jewish parties controlling for other potentially causal factors. Specifically, the dependent variable, party voting, was coded as 1 if a person voted for a certain party and 0 otherwise. The main explanatory variable was narrative proximity (proximity between the stories held by people about their nationality and the national stories held by parties). Controls included a slew of variables found relevant by previous work on voting behavior in Israel. The selected analysis is for Kadima (see Kadima column in Table 1 for details).",0,0.5461340546607971,0.4685493638545454
9KmL,"The claim was tested in part by conducting a t test on the mean pretest and posttest scores of students with disabilities in the EAI condition, across resource versus inclusive classrooms. The study primarily focuses on the contrast between these two timepoints, but the selected focal claim is the t test conducted at pretest",1,0.5257031917572021,0.6904454424545455
rmpb,"The claim is tested using a fixed effects panel model that accounts for spatial autocorrelation in both the dependent and independent variable.  The dependent variable is child bearing within cohabitation versus marriage).  The focal predictor is the male unemployment rate.  The focal test result is the estimated total effect of this variable on the outcome (see Table 2, fifth column).",1,0.5562556385993958,0.7709919158909091
AE7N,"The authors estimate a logistic regression model predicting whether people who were classified as black by the interviewer had higher arrest rates than those who were not classified as black, among respondents who did not self-identify as black in Wave 3 of the survey.",1,0.5624339580535889,0.6317374078454546
EA9j,"The author test the claim using a multilevel competing-risks model for housing transitions.  In the focal analyses, the competing risks considered include: 1) transition to a single family house, 2) transition to a terraced house, and 3) transition to an apartment. A piecewise linear spline was specified for each conception with nodes at the following durations: halfway during pregnancy (0.375 years after conception), at birth (0.75 years), and six months after a birth (1.25 years after conception). The focal test result concerns the slope coefficient for the halfway during pregnancy duration.  It can be interpreted as a linear change (over time) in the risk of making a transition into one of the above competing risks conditional on first conception.  The focal competing risk is the transition to a single family house.",1,0.5695151686668396,0.5998473703363635
GOzz,"Evidence for the finding is found in the OLS estimates of equation (16) found in Column 1 of Table 4. The tables presents results of OLS regressions estimating equation (16) using real income constructed from crop-level data on 17 principal agricultural crops (listed in online Appendix A), from 192 districts in India, annually from 1870 to 1930. The dependent variable is log real agricultural income. The predictor of interest is “Railroad in district,” which is a dummy variable whose value is 1 if any part of the district in question is penetrated by a railroad line (see Table 4 for more details of the model).",1,0.5936762094497681,0.8333053978818181
DkVR,"Column 1 of Table 1 presents OLS regressions of ln(CITES) on institutional ownership with controls for the ln(capital/labor) ratio, ln(sales), four-digit industry dummies, and time dummies. CITES is a count of a firm’s patents weighted by the number of future citations. Focal independent variable is “Share of institutions”.",1,0.5983293652534485,0.5690043786545455
1yV4,"For Model 2, overall satisfaction is predicted using a probit model with marginal effects. Counselor Veteran status is the key variable of interest in the second model. Results are reported in table 3 (see table 3 for details).",0,0.5582268834114075,0.44912207844545454
3v1d,"For models using the PTS, the aggregate CIRI index, and the variable created by Fariss (2014) we estimate linear models, fit using ordinary least squares, which is common practice in the literature. Our explanatory variables are drawn from the literature.  For our cross-validation analysis, we adopted the following rule to determine whether a covariate is an important predictor of state repression: if the lower bound (the .025 quantile) of the prediction error for the model including that covariate is above the upper bound (the .975 quantile) of the prediction error for the baseline model, then the covariate is marginally important. Figures 4 and 5 display results from cross-validation analyses in which the baseline model now includes civil war in addition to the natural logs of GDP per capita and population.",1,0.5649586915969849,0.530923869309091
EZVm,"The results of three Bayesian multilevel models are summarized in Figure 4, displaying multilevel models of attitudes toward responsiveness using separate measures of government and median citizen congruence. The selected model is Model 1, and the key explanatory variable selected is government congruence (see Figure 4 for details).",1,0.5341426730155945,0.6358356611545456
p7p3,"To control for the substantial increase in opportunities for noncompliance over time, the authors use a relative rather than an absolute measure of noncompliance as the dependent variable in their statistical analysis. The reasoned opinions variable puts the number of reasoned opinions sent to a member state in a given year in relation to the number of European legal acts in force in that year. The authors use the proportion of times when a member state is pivotal under qualified majority voting in the Council of Ministers (Shapley Shubik Index [SSI]) as an indicator of EU-specific political power. Model 1 in Table 1, the selected analysis, constitutes the basic model without interactions (see Model 1 in Table 1 for details).",0,0.5815115571022034,0.500852188190909
AG9r,"The claim was tested in part by estimating Summer X socioeconomic status interaction effects in a Tobit time-use multivariate regressions for a variety of activities known to influence children’s cognitive and social development; the focal test concerns the presence of a time gap for the indicator of ‘‘household income below$20,000’’ in the amount of time spent watching television. Justifications and descriptions of the control variables are provided  in Table A.1, and model specifications are shown on p. 1232.",1,0.5403902530670166,0.5343428559727272
xjg3,"To examine the effects of outcome framing and strategic orientation, univariate analyses of covariance were conducted for the solution dependent variables—quality, originality, and elegance. Gender was retained as a covariate. Remaining covariates were retained in the final analyses if their p-values were equal to or less than .10. Covariates were selected prior to the final analyses using a combination of forward insertion and backward deletion procedures where covariates were retained if they were significant using both methods.",0,0.4638485014438629,0.30470297350000003
BP9K,"The hypotheses were tested using SEM [structural equation modeling]. The detailed results obtained from the model are presented in Table 2, where the dependent variable is organizational identification. The authors then calculated the significance of the indirect effects in SEM using the bootstrap method with 5,000 bootstrap samples. As part of the evidence in support of the hypothesis, the indirect effect for 'External CSR–Consumers' is selected (see Table 2 for details).",0,0.555438220500946,0.2552338307636363
