Jvqe,"In Experiment 3, a comparison of responses to the Audiovisual-incongruent stimuli revealed that the proportion of correctly identified sounds was substantially better for sine-wave speech in non-speech mode (mean = .55) than for the same stimuli in speech mode (mean = .07), p < 0.05. | p < 0.05",0,0.5168316960334778,0.3191570408
Rjp9,"The results show that political connection with the incumbent provincial secretary has a large, positive, and statistically significant effect on local economic growth. Focusing on Model 3, the coefficient estimate (0.382, robust SE clustered at city level = 0.126, p < .01 [two-tailed]) suggests that, all else equal, the growth rates in connected cities are about 0.38 percentage points (or 10% of a standard deviation) higher than in unconnected cities.",1,0.584368109703064,0.6342005291363636
3zRW,"In conjunction with the positive and significant coefficient on logged relative political importance as a predictor of the violence outcome, the author finds a  negative and significant coefficient on the squared term for logged relative political importance (coefficient = -0.341, SE clustered by state = 0.104, p < 0.10).",0,0.5469582676887512,0.2871031305272727
Vxd5,"The author finds that districts with more military bases received more Department of Defense earmarks (effect estimate = 0.30, p < .05 [one-tailed]).",1,0.5683081746101379,0.6039049699454545
AxQ1,"The interaction term is negative, statistically different from zero at conventional levels, and large in magnitude (coefficient = -2.82, robust SE = 1.00, p < .05 [one-tailed]). As participation in the collaborative institution increases, the positive relationship between traditional processes and cooperative behavior decreases.",0,0.567662239074707,0.3424702000454545
G85O,"In Model 4, with the hegemonic and competitive variants of electoral authoritarianism disaggregated, competitive authoritarianism emerged as a strong predictor of democratic transitions (coefficient on competitive authoritarian indicator = 2.024, robust SE = .869, p ≤ .05 [two-tailed]).",0,0.5745988488197327,0.2991379368727273
EJWP,"Earnings rise across the threshold by $1,593 per FIU admission (SE clustered within grade bin = 604; p < .1 [p-value calculated using a clustered wild bootstrap-t procedure]).",0,0.5505561232566833,0.3590609718454545
E22r,"The Wald test with two constraints is significant (chi squared [d.f. = 2] = 6.50, p < 0.05), indicating the relative strength of each regulatory focus in predicting salesperson hunting and farming orientation, thus hypothesis 1a is supported.",0,0.49888110160827637,0.33639266953636365
b4Kk,"Nobel Peace Prize recipients were rated as significantly more trustworthy (M = 4.23, SE = 0.07) than were celebrities when photographed as part of their criminal prosecution (M = 3.13, SE = 0.10): t(74) = 8.95, p < .001, d = 2.10.",1,0.5064936876296997,0.8418078038090908
wQR4,"The result was a statistically significant interaction term between the maternal Mexican origin dummy variable (reference was white ethnicity ) and the zip code  level female unemployment rate, b =   .052, p < .01",0,0.5548843741416931,0.4021774418454545
J71L,"The result of the test was a statistically significant coefficient for “Relationship Quality”, B = −.04, SE = .01, p < .001.",1,0.5657867789268494,0.7892486665727272
7lmp,"The result was a statistically significant coefficient for the “boomerang father” dummy variable, b = -.80, SE(b) = .38, p < .05.  The reference category was having an unstable father residential pattern.",0,0.5547459721565247,0.32113690263636363
VjeV,"The result was a rejection of the strong invariance measurement model in favor of the weak invariance model (change in chi-square = 17.88, df = 8, p < .05)",0,0.50846266746521,0.3628449190727272
Vj0p,"The result was a statistically significant coefficient for remarriage, b = -1.73, SE = .01, OR = .18, p < .001.",1,0.536360502243042,0.7661504456363635
D2LY,"The result was a statistically significant regression coefficient for “fertility expectations” in the equation contrasting going to a 2 year college versus never attending any college, B = -.05, p < .01, SE = .01, RRR = .96",0,0.5466666221618652,0.4878539733545454
j2AJ,"Critically, of these there were substantially more same accent errors (M ± SD = 8.77 ± 2.71) than different accent errors (M ± SD = 3.60 ± 3.00), t(29) = 6.62, p < .001, r = .78.",1,0.4968958795070648,0.7751226108727273
OJKm,"When not guided, they experience a 19% success rate of finding a bee nest upon tree inspection (101/523 tree inspections); while being guided, they had a significantly higher, 58% success rate, discovering 18 nests from 31 tree inspections (chi squared = 24; df =1; p < 0.001).",1,0.5146185159683228,0.8180024587454546
V4kX,"The results indicate that there is a moderate relation between the BIS and SC. The summary effects range from .24 to .31.  For the fully corrected Hunter and Schmidt (2004) model, the summary effect (r) was 0.30, with a 95% CI [0.26, 0.34]",1,0.4964771866798401,0.7478294698636364
9a3a,"The result was as statistically significant difference in the coefficients on peer deviance across models that were estimated on two different samples - first generation versus third generation immigrants, z = 3.47, p < .001.",1,0.5451619625091553,0.6569035348636363
0qY1,"For participants who were instructed to track the true location of the ball with their eyes (Ball Tracking), fixation durations at the box location without the ball (No-ball) were longer under False- relative to True-belief conditions (t > 2.98, p < 0.01)",1,0.5021369457244873,0.6905099662454546
y3Nk,"Conditional on attempted enforcement, net support for the authority (−3 to +3) was 0.89 in the salary treatment, as compared with −0.21 in the appropriation treatment (p < .001, two-tailed). In other words, on average, about one in three untargeted citizens chose to assist a salaried authority in her enforcement duties. Untargeted citizens intervened less often in the appropriation treatment — and more likely than not on behalf of the target.",1,0.5553894639015198,0.759623718418182
p3V0,"The coefficient estimate on the “Male x Double cohort” term is 1.009 (clustered SE = .345, significant at the 1% level), suggesting that males coped better with the increased competition than females.",1,0.5322273969650269,0.5674266805909091
WLkV,"Columns 1 and 2 of table 2 show that first-stage behavior differs considerably between the two treatments. Average effort in the first stage of the two-stage treatment is 84.8 (median = 84). Thus, subjects behave much more competitively in the multistage tournament, exerting efforts that are almost 20% higher than those of their counterparts in the one-stage treatment (average effort = 71.7, median = 75). A Mann-Whitney U-test confirms that the treatment difference is statistically significant (|z| = 2.536, p = .011, two sided).",0,0.5242852568626404,0.4920494797636364
m8NR,"The second-stage estimate in column 3 shows that a $10,000 increase in home equity leads to 0.71 of a percentage point increase in the likelihood of college enrollment, which is statistically distinguishable from zero at the 0.4% level (estimate on real home equity ($10,000) term = .0071, SE clustered at area level = .0025).",1,0.566523015499115,0.7322700968000001
BrBp,"Consistent with Hypothesis 1, the effect of condition was significant, B = 0.20, SE = .09, t(96) = 2.35, p = .021. Participants in the Enhance Difference condition were less likely to experience mixed emotions (Average BEnhance = 0.79,SE = .07) than participants in the Reduce Difference condition (Average BReduce = 0.59, SE = 0.05) when the clip was pleasant.",0,0.34274983406066895,0.34405803827272724
OGX3,"consistent with our predictions an actor effect of PD-self emerged for the warmth/trustworthiness dimension such that participants who felt they did not meet their partner’s warmth/trustworthiness ideal standards reported experiencing more agitation-related emotion (b = -0.17, t = -2.20, beta = -0.14, p < 0.05).",0,0.4479219913482666,0.4976756151363636
LGYx,"productivity had a significant positive effect on generosity, beta = .57, t(80) = 7.64, p < .001",1,0.5091475248336792,0.6460640571454546
EeJZ,"For Caucasian faces rated by Caucasian raters, greater attractiveness was predicted by increased yellowness (b⁎; beta = 0.658; p = .032) of the face",0,0.47231781482696533,0.5
24rk,"Furthermore, as expected, this main effect was qualified by a significant interaction between profession status and relationship involvement [F(1, 115) = 12.24, p = 0.001].",0,0.48777836561203003,0.4912723033545454
EK7r,"The result was a statistically significant difference in theft across the treatment and matched control samples, B = .59, SE = .28, p < .05.",0,0.5885230302810669,0.3404487461090909
yN1Q,"The result was a statistically significant coefficient for the “Prosecutorial recommendation” variable, B = .69, SE = .02, p < .001.",1,0.5375115871429443,0.8228993560181818
1WLv,"The result was a statistically significant coefficient for delta (change) share of conspicuous consumption,  b = .065, SE= .036, p < .10",0,0.5068937540054321,0.3159901584636364
N8DV,"The baseline model (Model 1) shows that targets’ nuclear defense pacts are negatively associated with dispute initiation at conventional levels of statistical significance. On average, the probability that a state will be targeted in a violent conflict decreases from 0.0034 to 0.0009 when DEFENSE PACT WITH NUCLEAR POWER is changed from 0 to 1 and all other factors are held constant (coefficient on defense pact with nuclear power term = -0.388, robust SE = 0.0938, p < 0.001 [two-tailed test]).",1,0.5628717541694641,0.8343595048454546
7ybJ,"The difference in application rates is driven by men systematically referring other men when given the choice: women refer women at approximately the rate by which women apply themselves through the traditional method (43% of the time), while men refer women only 23% of the time. The difference between male and female conventional applicants is significant at the 1% level (p = .002) (column 4 of panel C in table 1).",1,0.5492637753486633,0.7200119520727274
dGgm,"In Model 1d, Panel A, Table 3, the DDD estimate shows that the black self-employment rate rose 3 percentage points more in cities that initiated a program than in the control cities (Black-white, treatment–control estimate = 2.84, absolute value of the t-ratio = 3.11, statistically significant at the 1% level). This effect is highly significant statistically and implies that set-asides reduced the black-white self-employment gap by roughly one-third.",1,0.5773043632507324,0.6492729235090909
mZVR,"The authors find that in the written exam, the performance of males dominates that of females in the FOSD [first-order stochastic dominance] sense: in row 1 of table 5, the authors reject the null hypothesis that females' performance weakly stochastically dominates males' performance (test statistic = 1.3279, p = .0294), but cannot reject the null that males' performance weakly stochastically dominates females' performance.",1,0.5610297322273254,0.5906620004363637
5v5l,"For this specification (Model 6, column 3, table 4), the bottom row shows that on average skills increased by about 4.6% (estimate = .046, bootstrap SE = .011, statistically significant at the .01 level).",1,0.5559349060058594,0.8627218752545454
xjmA,"The estimated coefficient on the housing price index is negative; in metropolitan areas with higher prices, the return to education is lower (coefficient = -.083, Huber-White robust SE = .0248).",1,0.5300976037979126,0.7576216215999999
X4Pp,"For all executives, and controlling for executive and firm fixed effects (Table 3, Column 2), a one standard deviation increase in (within-firm) import penetration generates an increase in the sensitivity of pay to performance of 1.7 percentage points, or 6.8% relative to the baseline sensitivity (coefficient on performance x import penetration interaction term = .85, SE clustered at firm level = .24, significant at 1%).",1,0.5599074959754944,0.6842707260272727
m85b,"The coefficient on peer SAT verbal (.338, robust SE clustered by class by squadron = .107, significant at the .01 level) is statistically significant.",1,0.5574374794960022,0.6310455158363636
LyWB,"The likelihood that a county secedes to form a new district is decreasing in its DEC share (coefficient on DEC share ratio term = -0.79, SE = 0.20, p < 0.01).",0,0.5788992643356323,0.4925540269
r32d,"Holding other characteristics constant, the proportion of “no” votes for applicants from (the former) Yugoslavia is about 15 percentage points higher (t value > 14.5) than for observably similar applicants from richer northern and western European countries (the reference category). This constitutes an increase of about 40% over the average proportion of “no” votes (coefficient on former Yugoslavia term = 14.59, SE = 1.00).",1,0.5651081204414368,0.8629469656272728
l8zy,"Thus, in the year following the birth of their first child, women’s fundamental frequency (F0) parameters dropped on average by 14.6 Hz (F0 mean), p < 0.001",1,0.5035786628723145,0.7198087423000001
xQO3,"participants in the charismatic condition were more likely to choose the cooperative option (93.6% chose to hunt the stag) than those in the non-charismatic condition (83.6%, chi squared (1, 305) = 5.43, p = 0.02",0,0.47269824147224426,0.3461342048272727
yyyR,"Among boys, a main effect of group membership (F (1,432) = 19.9, p < 0.001, eta squared = 4%) was found, showing higher allocation towards in-group recipients (M = 38%, SD = 24%) over out-group ones (M = 34%, SD = 23%)",1,0.5516843795776367,0.7783034914363636
DaKY,"We observed that waist-to-hip ratio (WHR) was statistically significant. Note that the coefficient is negative. In other words, participants with low WHR tended to cooperate more in the prisoner’s dilemma game (PDG).  From Table 3: Ln(WHR) coefficient = -8.394, Wald = 6.008, df = 1, p = 0.014.",0,0.4688595235347748,0.3021739370818181
mD8j,"The self deception score (self-deception questionnaire, SDQ) was a significant predictor of depressive symptomology (Beck Depression Inventory II, BDI-II), beta = -0.27, t(72) = 2.50, p < 0.02",0,0.47707295417785645,0.2908322126181819
8wkv,"bFollowing a 2 X 3 within-subjects ANOVA with prime–target compatibility, and free/cued ratio on ratings of control, a post-hoc t-test found higher control ratings for compatible prime-targets (M = 57.72) than incompatible (M = 52.61), t(15) = 5.03, p < .001.",1,0.5061702132225037,0.5566007831181818
7REZ,"positive affective presence was significantly associated with the partner’s romantic interest, b = 1.15, p < 0.01",0,0.5035212635993958,0.4973808226363636
8lZv,"The negative association between the number of friends and the percentage of co-ethnic friends is significantly stronger for minority members than for Dutch majority adolescents, as indicated by a significant interaction effect between a dichotomous variable for Dutch/non-Dutch ethnic background and the number of facebook friends ( p < .001)",1,0.5363281965255737,0.6612344373818182
b2mX,"After controlling for field of study, there is a net disadvantage for AA-1.25 (Asian American men who completed their education outside of the U.S. prior to college and attended college in the U.S.) compared to white men, regression coefficient in Model 3 = -0.1145, p < 0.001, indicating an 11% earnings disadvantage.",1,0.5538259148597717,0.6826527020727273
W4xp,"The reduction in fluidity experienced by the most recent cohort (Cohort 3) compared with the earliest cohort (Cohort 1) is statistically significant for men, coefficient = 0.16, p < 0.05",1,0.5791310667991638,0.5459397242454546
Y8jQ,"The evidence provides strong support for the claim that members of the president's party will be advantaged in the contest for distributive benefits (coefficient on President's party term = 0.046, robust SE clustered by state = 0.012, p < 0.01).",1,0.5608940124511719,0.6698481071181818
RBe9,"Per capita income in its cubed form is a significant predictor of gender equality in Model 1, and the directionality (+) corresponds with the gender Kuznets curve (GKC) hypothesis (coefficient on per capita GDP cubed term = 0.007, robust SE = 0.003, p > .05 [sic; p-value transcribed from legend in Table 2]).",0,0.5647939443588257,0.3323840903818181
gr37,"The second-stage estimation (column 2) shows the expected result: the coefficient of ẑ, the predicted share of VIIT between two countries, is positive and significant (coefficient on predicted VIIT share term = .180, bootstrapped SE = .041, p < 0.001 [two-tailed]).",1,0.5574231147766113,0.8305817164545455
xYek,"In Study 1, the quadratic-by-linear effect of prohibitive voice and LMX (leader-member exchange) was the most salient predictor, explaining roughly 35% of the variance of promotability (relative weight [RW] = .35, [.02,.15]). Moreover, a relative comparison analysis showed that the relative weight for the quadratic-by-linear interactive effect of prohibitive voice and LMX was significantly different from the relative weight for the quadratic-by-linear interactive effect of promotive voice and LMX (RW = .05 [-.13, -.02]).",0,0.45100563764572144,0.33830382017272725
521q,"An interaction between Honesty-Humility and the experimental condition was found (From Table 2: B = -0.82, p < 0.01, Odds ratio = 0.44)",0,0.43238747119903564,0.5171827734181819
wpe4,"In Experiment 1, there was a Condition (Different Insides, Different Outside) X Trial Type (2 Objects, 1 Remain; 1 Object, Box Empty; 1 Object, 1 Remain) interaction on the duration of reaches into the box that infants made, F(2, 30) = 4.64, p = .017, partial eta squared = .23.",0,0.46065765619277954,0.27957297723636365
Kj9d,"A 2 x 2 x 2 repeated measures ANOVA on reaction times with days-direction (thumb-little finger, little finger-thumb), hand posture (prone, supine) and language (English, Hebrew) as within-subjects independent variables yielded a significant triple interaction, F(1, 19) = 16.69, p < .002, partial eta squared = .47, such that the compatible mappings (Mapping A for English, Mapping G for Hebrew) were the fastest.",0,0.528563380241394,0.4238639715454546
8w0d,"A GLMM modeling infants’ responses (point toward the absent object, or no point) that included the same/different condition as a predictor, compared to the null model comprising only the random effect of subject,  showed a significant influence of condition (likelihood ratio test, chi squared  = 4.46, df = 1,p = .034).",0,0.5120978355407715,0.32955148
EQxa,"In an F test on participants’ yes/no answers to the moral dilemma, with factors of mood (positive, negative) and frame (active, passive), affective influences on moral judgment varied with decision frame, F(1, 396) = 29.0, p < .001, partial eta squared = .07",1,0.4810769557952881,0.706930060281818
Q2pa,"A 2 (correct versus error pre-interval trial) X 17 (interval length) repeated-measure ANOVA with proportion correct on subsequent NOGO trials as the dependent variable yielded a significant pre-interval trial type by interval length interaction, F(16, 5408) = 11.95, MSE = .126, p < .001.",1,0.46534860134124756,0.7054060031818182
yJXk,"Of the 16 children in each group in Study 3, 6% (1/16) in future-self group made the correct conjoint choice, and 44% (7/16) in the future-other group made the correct conjoint choice. .There was a significant difference in performance between the two groups: Chi squared(df = 1, n = 32) = 6.00, p < 0.02",0,0.477422833442688,0.3059228371090909
97gX,"A within-subjects ANOVA with class (faces, dogs) and orientation (upright, inverted) as independent factors and 2-alternative forced choice accuracy as the dependent measure showed that 7-year-olds had a difference in accuracy between upright and inverted faces, but no such asymmetry for dogs, resulting in a significant interaction, F(1,16) = 18.85, MSE = 104.89, p < .005, which confirmed the inversion effect (up-right–inverted) was significantly larger for faces (16.08%) than dogs ( -5.49%).",1,0.3814372420310974,0.6423634109181818
JNY2,"When we looked at the individuals who have never experienced any major earthquake, 39 out of 597 (or 6.5%) had a pro-social job, whereas 90 of the 903 participants who experienced a major earthquake (or 10%) had a pro-social job, chi squared (1, 1500) = 5.39, p = .020.",0,0.5460451245307922,0.2901483473909091
9RYZ,"There was a significant effect of age squared on well-being, as seen in Table 5: coefficient of age squared = 0.07, p < 0.001",1,0.5552877187728882,0.8230200035999999
5mZ3,"The authors find a significant increase in 4-year graduation rates due to earning higher AP scores at the 3/4 threshold, when the score of 4 coincides with the minimum credit-granting score at the college they attend (effect estimate of being above the threshold = .008, heteroskedastic robust SE clustered by student = .002, p < .01).",1,0.5384268164634705,0.7689091952909091
8vke,"The estimated average treatment effect for the contacting the media outcome is 0.07 (SE clustered at village level = 0.02, significant at the 1% level).",1,0.5480896830558777,0.7077172897363637
0v9a,"Column 2 of Table 5 shows that having a conflict in the grid cell makes it 10% more likely that there was a conflict in the same grid cell between 1997 and 2010 (point estimate = 0.10, robust SE clustered by country = (0.04) (0.04), 1% significant).",0,0.5606817603111267,0.4516394178363636
WNE2,"The coefficient on the measure of membership inequality is negative, as expected, and distinguishable from 0 at standard significance levels (coefficient = -10.02, WSEV [window subseries empirical variance] SE = 4.44).",0,0.5572168231010437,0.4688320097
gpbQ,"The results are consistent with the authors' theory: oil affects media freedom negatively and significantly (coefficient on Log (oil price ∗ oil reserves) term = -2.87, robust SE = 1.14, significant at 5%).",1,0.5790370106697083,0.5565100495181818
J7ek,"A one-way ANOVA found that participants in the ‘taxicab’ scenario gave estimates of the total number of taxis that were sensitive to the number of observations they had seen, F(2, 44) = 9.57,MSE = 3.69, p < .001",1,0.47977808117866516,0.7724728485636365
AyVj,"The result was a statistically significant coefficient for the dummy variable indicating that the respondent perceives a less than 50 percent chance of being killed by age 21, b = -.023, SE = .004, p < .01",0,0.5664012432098389,0.5167304503454545
8R9d,"The partial networks of the high openness to experience group had a significantly smaller ASPL across the bootstrapped samples compared with the partial networks of the low openness to experience group.  Negative t-statistic denotes the high openness to experience group having lower values than the low openness to experience group.  From Table 3, for 90% of nodes remaining (df = 1998), t = -65.69, d = 2.94",1,0.5174664258956909,0.7782156210363635
PgNr,"When both partners’ mean felt security were entered as the sole predictors of relationship satisfaction (within partner), they accounted for 27 and 44% of the variance (i.e. R squared) of men’s and women’s T1 relationship satisfaction.  From Table 3, pooled across genders - the unstandardized coefficient for felt security predicting T1 relationship satisfaction = 0.21, z = 4.46, 95% CI [0.12, 0.30] p < 0.001",1,0.5494571924209595,0.7985750641545454
d5v3,"high levels of right wing authoritarianism (RWA) predicted significant increases in depression over time (beta = .12, p < .05).",0,0.5083650946617126,0.29487241738181824
VP9E,"Under the CRS model, the two-year mean score rose from 0.7678 in the pre-merger years to 0.8255  in the post-merger years (mean diff = .0577, p = .008, T(df) = 2.958(19).",0,0.43220430612564087,0.44787676768181817
3dJ7,"The result was a statistically significant path coefficient linking “Unlearning” to “Exploitation of Knowledge”, path coefficient = 0.617 t(bootstrap) = 9.79, R-squared = 0.39.",1,0.4763507843017578,0.7443829572545453
O4rB,"The result is that a buyer's employee rights protection is significantly correlated with its financial performance (r = 0.22, p-value < 0.01)",0,0.5187358260154724,0.5232270367363636
AL1J,"The result was a statistically significant difference between the PBG × 3 condition to the no guarantee condition,  (F = 4.11; p = 0.04).",0,0.48394012451171875,0.2113981162272727
gkL4,"The result was a statistically significant coefficient on the interaction term ""CEO Tenure × industry dynamism”, b =  -1.82, SE = 1.05, p < .05",0,0.5586597323417664,0.3141845923545455
eQVm,"The result was a statistically significant path coefficient linking mall image to mall attitude, B = .86, t-value = 21.40",1,0.5216984152793884,0.768338957590909
G8Vp,"The result was that the operation-focus group (cognitively simple group) and Non-Focus group (cognitively non-focus group) have mean ROAs of 1.2 and 6.82%, which are lower than cognitively complex groups. The test statistics indicates that there is a significant difference in ROA (F = 2.3;p < 0.1)",0,0.4940911531448364,0.3815656116272727
01Ll,"we tested the serial indirect effect of narcissism, through empathy and guilt, on willingness to apologize (PROCESS model 6; 5000 bootstrap samples). This analysis indicated that the indirect effect was significantly different from 0(b = -.005, SE = .003, 95% CI [-.01, -.0009]).",0,0.5023465752601624,0.4704835196000001
E09Z,"Active union members (those who participate in union protests, campaigns, or outreach activities) are more likely than inactive members to become involved in school decision-making, odds ratio = 1.764, p < 0.05",0,0.5694698691368103,0.5250257195545455
