jJ,"Results indicated that the difficulty of changing occupations was perceived as greater, the further away (ignoring direction up or down) the two respective occupations were in the three-dimensional space, r = 0.26, p < 0.001",1,0.45232337713241577,0.8515922711727272
1VE,"Out-group members were described less frequently in terms of their basicmental states (estimated marginal mean = 9.70%) than were in-groupmembers (estimated marginal mean = 27.60%), F (1, 68) = 14.948,p = .000,",1,0.46633338928222656,0.6942953431454545
G1O,"Republicans took longer than Democratsto initially disavow Obama political conspiracies, B = 183.81, SE = 40.84,t(4.50), p < .001",1,0.5005040168762207,0.7587326298636363
XGZ,"In line with our predic-tions, intentions for collective action in the common ingroup identitycondition (M = 3.94, SD = 1.60) were signiﬁcantly lower than in theseparate group identity condition (M = 4.81, SD = 1.63), t(114) =2.37, p = .020, and Cohen's d = .55.",0,0.382527619600296,0.4115722492454546
rvb,"Among participants in the high causal uncertainty condition, a significantly greater proportion of participants chose to resume if they were interrupted from a more abstract (vs. more concrete) thinking task (M = 78.95% vs. M = 47.83%; B = − 1.41, SE = .70, Wald = 4.04, p = .04, OR = 4.09)",0,0.45880764722824097,0.23514733321818185
rjb,"Most importantly, there | was a significant certainty × objective ambivalence interaction, B = .04,t(169) = 2.28, p = .02, 95% CI: [.01, .07].",0,0.4251599609851837,0.3887652256818182
ZEa,"participants exhibited lower state self-esteem after exposure to direct-gaze anger than after exposure todirect-gaze joy t(51) = 2.66, p = .01, rpb = .35,",0,0.44859635829925537,0.3849048935181818
pz8,"As predicted, Korean participants' ac-curacy (63.2%) was higher than that of the Caucasian participants(58.1%), t(58) = 1.95, p = .056, d = .51.",0,0.45022475719451904,0.5
ArY,"participants fixated the expected schematic cue earlier with increasing rape myth acceptance (RMA), leading to a negative correlation between RMA and total time (in ms) before the first fixation of the bottle of wine, r(24) = −.36, p < .05, one-tailed.",0,0.40269339084625244,0.5
V85,"Critically, these effects were qualified by the interaction of interest, F(1, 57) = 4.79, p = .033, partial eta squared = .08",0,0.41663452982902527,0.2697852726454545
YbK,"Our analysis revealed that implicit partner affect (IPA) was positively predictive of relationship satisfaction (RS), controlling for implicit self-esteem (ISE), relationship length, age, and sex, b = .23,t(100) = 2.08, p = .04",0,0.46773576736450195,0.3097514166727273
rpq,"When observing White targets, participants judged anger as lasting longer on an old (M = 10.41 s, SD = 4.68s) compared to a young face (M = 8.86 s, SD = 4.35s), t(47) = 4.18, p = .001, d = -0.34.",1,0.3851308524608612,0.6009678756272727
Ow0,"In Experiment 3a, the difference in current money management stress between the positive and negative frame conditions is measured at F(1,104) = 7.66; p=0.007; omega squared = 0.059. (In contrast, the difference in perception of future financial security between these two conditions was not significant.)",0,0.5126640200614929,0.4221259183818182
0b8,"A logistic regression estimating the effect of political ideology (measured continuously) on buying/boycotting behavior, adjusting for age, religion, gender, income, and education, with fixed effects for country yielded a significant effect of respondant politics,  regression coefficient = 0.124 (0.003), p < 0.01",1,0.43632107973098755,0.6367869311909092
l4J,"There was a significant two-way interaction in Study 3 between procedure (TEL vs MEL) and time scarcity (control, low, high), (F(2, 218) = 3.32, p < .05)",0,0.4780917167663574,0.3612528637545454
5JE,"we found a significant effect of the clarity  x rating distribution interaction on desirability (M_Bimodal/Clear = 3.8 vs. M_Bimodal/Conflicted = 4.2 vs. M_Unimodal/Clear = 4.2 vs. M_Unimodal/Conflicted = 3.7; b = –.17, SE = .08, t(123) -= –2.15, p = .03",0,0.4387461841106415,0.22411387350909093
d8p,"A contrast analysis between single- and multi-serving food at the low processing capacity level in Study 2 yielded that perceptions of having an adequate quantity of Sport Beans were higher for those in the single-serve condition (M = 5.36) than in the multi-serve condition (M = 4.11; F(1, 108) = 10.61, p < .005).",0,0.4196171164512634,0.4857409699636364
Q9m,"In study 2, the partial correlation (controlling for parents’ materialism) between conditional material rewards at third grade and the success materialism facet yielded partial r = 0.21, where p < 0.001",0,0.4878537654876709,0.5204074839
4mV,"In Experiment 1, a 3 (Country-related affect) x 2 (product origin: Japan vs. China) x 2 (strong vs. weak product description) between-subjects ANOVA on participants’ evaluations yielded a significant interaction between CRA and product origin, F(2, 212) = 2.78, p = 0.05",0,0.4675421714782715,0.3276114624
BaDx,"In study 3, a regression analysis with lottery choice as the dependent variable and instrumentality index and inclusion/exclusion condition as predictors yielded a significant effect of instrumentality index, Beta = 0.39, t(33) = 2.36, p < 0.03.",0,0.46066364645957947,0.2803480892090909
gw38,"An F test of the difference in model fit to Study 1 data with volume of soup served as the dependent variable and diameter ratio as the predictor found that a three-degree polynomial model outperformed the linear model, delta F(2,3) = 40.2, p < 0.01.",0,0.2563570737838745,0.3971086889090909
jN32,"The results of Study 1a showed that, consistent with our hypothesis, participants in the cold drink condition indicated a higher liking of romance movies (M = 4.57) than those in the warm drink condition (M = 3.80; F(1, 51) = 6.14, p < 0.05).",0,0.43947070837020874,0.18068097983636364
dDz8,"Participants in a negative affective state rated the tactile appeal of the lotion more favorably (M = 7.00) than participants in the positive affective state (M = 5.76; F(1, 134) = 7.98, p < 0.01).",0,0.44033002853393555,0.32888083171818183
NNGV,"A regression over participants in the introjection (other-rating first) condition, of respondent’s attitudes (how much they like the product) on CNFU (consumer need for uniqueness) level, adoption level (that participant’s prediction of what percentage of other consumers would use the product), and their interaction.  This yielded a significant CNFU level by adoption level prediction interaction (Beta = -0.013, t(131) = -2.26, p < 0.05)",0,0.4489979147911072,0.3315465764454545
egKl,"In Experiment 2, a Poisson regression of Low progress participants’ log-transformed frequency of visits yielded a main effect of earned (M=0.33) vs. endowed (M=1.35 times) progress, Beta = -0.71, Chi squared (1, N=86) = 22.78, p < 0.01.",0,0.43421471118927,0.522652290790909
1zb7,"In the blood-donation replicate experiment, a two-sample t test with condition (ideal-first vs standard-only question) as the independent variable and likelihood of donating blood on the final question as the dependent variable found that estimates in the ideal-first condition (M = 40%) were reliably lower than in the standard condition ( M = 71%; t(25) = 2.20, p < 0.04).",0,0.43473947048187256,0.3755441233818182
RGg7,"A main effect of video presence on ratings of eyewitness believability, yielding F(1, 223) =  35.25, p < .001, d  = 0.79, 95% CI [0.62, 0.96]. Participants who did not see the videotaped administration believed the eyewitness to be more credible (M = 5.02, SD = 1.34) than did participants who did seethe administration (M = 3.98, SD = 1.31)",1,0.508726954460144,0.7445726838363637
Ba9E,The test statistic is a Chi-square test for two-way contingency tables.  Chi-square = 89.93 with df = 349 p < .001. 78% of subjects who received reinforcement for their altered choice stuck with that choice – only 28.7% stuck with their altered choice when they did NOT receive reinforcement.,1,0.5172281265258789,0.827416319790909
a8AB,"However, results identified different and distinct patterns amongthe signature decisions of knowing participants. Innocents whowere characterized as knowing were more likely to sign the waiveform (psigning  .90) than the invoke form (psigning  .50),b  2.18, SE  0.96, p  .022, 95% CI [4.06, 0.30],z  2.28.",0,0.4781514108181,0.41270432754545455
zKJ1,"a significant main effect of German versus Dutch negotiator (high vs. low uncertainty avoidance) F(1, 27)= 3.50, p = .072, d= .51, 95% CI [–.05,1.08]",0,0.4649665951728821,0.20781996790909094
25Yg,"a statistically significant VIQ regression coefficient: b = .28. SE= .03, predictor F^2 = .73, p < .01",1,0.5572599768638611,0.6720300966818179
K47e,"a significant main effect of the PTP conditions (Neg-PTP vs No-PTP) – Chi-square = 13.64, df=1, n=320, p < .001, V= .21, 95% CI [0.09, 0.32]",1,0.5175879597663879,0.8146950920545456
a84D,the mean on the social status measure being higher for those involved in gang activity versus those that were not (43.16 vs. 34.98) – p < .001,1,0.5488261580467224,0.7591864576454544
gwpg,"a statistically significant main effect for feedback, Wald = 4.32, p = .04, exp(B) = 2.09, 95% CI [exp(B)] [1.04, 4.17], Cohen’s h= .34",0,0.5307205319404602,0.3661587736363636
YBWN,"a significant main effect for the 4-category mental health variable – F = 26.62 (3,233), p < .001, eta-squared = .27",1,0.5489811897277832,0.8354008153727274
zK4y,"a statistically significant [exponentiated] coefficient for YLS/CMI (Wald Chi-square = 55.7 (df=1), p <.001, Exp(B) = 1.17).",1,0.5309858322143555,0.7321705285636363
WpON,"a significant evidence by confession interaction, F(1, 120) = 11.11, p < .001, eta-squared = 0.156, reveling a substantial effect of the confession in the weak evidence condition across both types of confessions",1,0.49274277687072754,0.7592062185909092
PK5J,an area under curve (AUC) estimate = .657 and 95% CI [.640–.676] that did not include .5,1,0.5191433429718018,0.8115919102181818
JYKk,"A statistically significant coefficient for the interaction term between ""individualism versus egalitarianism” and race/ethnicity (unstandardized beta = -.43, SE = .18, p < .05)",0,0.5121394991874695,0.3675539341545455
rO4R,"A Procedural Justice (y/n) x Hierarchical Position (high/low) x Sense of Power (high,  low) ANOVA on the dependent variable formed by taking the difference of contributions in round 1 vs. round 2 yielded a significant three-way interaction, F(1, 255) = 5.68, p = 0.02, partial eta squared = 0.02.",0,0.3446683883666992,0.3282817243545455
0RPb,"A regression of organizational identification at time 2 on intrinsic motivation at time 1, controlling for recent earnings, total earnings and extrinsic motivation, yielded a significant effect, b = 0.427, SE = 0.060, t = 7.11, p < 0.001",1,0.5240805745124817,0.6531243129818182
WpWX,"In Study 3, a regression model of job search self-efficacy on the predictors of APGO (avoid-performance goal orientation), LGO (learning goal orientation), perceived incivility, the interactions between APGO x perceived incivility, and LGO x perceived incivility, and control variables  (age, gender, race, prior work experience and trait negative affect) yielded a significant interaction between  APGO x perceived incivility, b = 0.26, p < 0.05.",0,0.41750696301460266,0.2169731952636364
zKGr,"Bivariate biometric analyses using the Cholesky decomposition model yielded a significant effect interpersonal conflict at work on job satisfaction over time with genetic influences controlled for, i.e. a path coefficient of e21 that was significantly different from zero at the p < 0.001 level (e21 = -0.16, 95% CI = [-0.22, -0.11]), variance explained = 2.6%",1,0.4904870390892029,0.7626598926
RGqE,"In a hierarchical regression of peer rated task performance in Study 2 on control variables (i.e., gender, language proficiency, international experience, work experience, cognitive ability, and BigFive personality), response judgment, and situational judgement, situational judgment explained an additional 4% variance in task performance (p < .01) over and above response judgment and control.",0,0.48563405871391296,0.4387662265272727
3OGW,"In a model with both main effects and interactions with time for the key predictors of demands (work hours, spouse work hours, shift work, work responsibility, and number of children), a within-person increase in work hours is associated with a within-person increase in the slope of the BMI growth trajectory (b = 0.001, p < .01).",0,0.4653486907482147,0.5084875534000001
DEmL,"In a meta analysis weighted by sample size and corrected for range restriction and attenuation due to predictor and criterion unreliability, extraversion was found to correlate significantly more strongly with the LGD (rho =  0.15, SDrho = 0.10, 95% CI = [0.12, 0.19]) than with the CA (rho = -0.04, SDrho = 0.06, 95% CI = [-0.14, 0.06]).",1,0.46366581320762634,0.7853756876181817
PK3K,"A moderated mediation analysis of the indirect effects on employee organizational deviance (through supervisor abusive behaviors) of hostile climate perceptions conditional upon supervisor conscientiousness found non-overlapping 95% confidence intervals at -1SD of supervisor conscientiousness (-1SD = 4.43, point estimate 0.06, 95% CI [0.01, 0.12]) vs. +1SD supervisor conscientiousness (+1SD = 6.51, point estimate -0.02, 95% CI [-0.06, 0.01]).",0,0.47945183515548706,0.3477403031272728
8EeW,"Team performance was modeled as the dependent variable with predictors for a series of control variables (team size, task type, mean organizational tenure, team’s polychronicity mean, gender age and tenure diversity) the standard deviation of the team’s polychronicity, STC (shared temporal cognition) TMS (transactive memory systems), and the two-way interactions between the standard deviation of polychronicity and each of STC and TMS. A simple slopes analysis of this model yielded that when teams were low in shared temporal cognition, the relationship between polychronicity diversity and team performance was significant and negative (slope = -1.20, t = -2.33, p < 0.05)",0,0.46087875962257385,0.2434103498090909
pYQ3,"Regression of branch-level empowerment climate on branch-level HPWS (high-performance work systems), controlling for bank type and branch size yielded a significant effect of branch-level HPWS, (Beta = 0.32, p < .05)",0,0.4672704339027405,0.3833612592363636
egX9,"The analysis used a hierarchical linear model with post-shift negative affect as the dependent variable, indirect care task satisfaction and direct care task satisfaction as level 1 predictors, and at Level 2, the model included ratings of nurse-physician relationship quality, psychological resilience, and the two-way interactions between these two predictors and the two task satisfaction measures. In this model, the standardized predictors for direct and indirect care had non-overlapping 95% CIs (for direct care,   gamma = -0.60, 95% CI [.-76, -.44]; for indirect care, gamma = -0.09, 95% CI [-.19, .01])",0,0.46591663360595703,0.3865092292454546
PKAw,"Multilevel modeling of creativity in a mixed model with help seeking as the major predictor variable, controlling for group as a random variable as well as gender, tenure, education, creative personality, status, and help received yielded a significant positive relationship between help seeking and creativity, gamma = 0.62, t(228) = 8.75, p < 0.01",1,0.46816661953926086,0.5344561226272727
AWmN,"In a mediation analysis with team performance as the dependent variable, team potency as the mediating variable, and three independent variables (goal and process clarity and servant leadership), there was a significant and positive indirect effect of goal clarity on team performance outcome through the mediator of team potency, E(ajbj) = 0.16, p < .05, SE = .04, 95% CI [.07,.24].",0,0.48080652952194214,0.3147367025818182
pYPj,"Hierarchical linear modeling of individual task performance within groups as the dependent variable and individual-focused transformational leadership (TFL) as the predictor yielded a significant effect ( gamma =0 .17, p < 0.05, Rsquared = 0.02)",0,0.4591422379016876,0.3222489106454545
Ba3Q,"In a second-order conditional latent growth model analysis, the intensity of increase in psychological contract breach was significantly and positively related to the intensity of decline in affective commitment (Beta =  .54, p < .01)",1,0.5041459798812866,0.5666138044181818
XvLK,"Hierarchical multiple regression of workplace deviant behaviors on self-esteem, contingent self-esteem and the two-way interaction yielded a significant interaction effect ( Beta = .32, p < .01), with the interaction term explaining an additional 10% of the variance in workplace deviance (delta r squared = 0.10)",0,0.48861438035964966,0.3416184641181818
GeVd,"there is a positive and significant interaction between SBBE and brand age (λ8 = .01, p < .01),suggesting that the effect of SBBE on attendance gains further leverage when brand age is higher",0,0.4737565815448761,0.4797343824999999
OkRb,"a significant SBC × NOWOM interaction (F (1, 135) = 7.37, p < .01)",0,0.4985507130622864,0.421133007609091
Geep,"The results of mean difference tests for green marketing versus green technology partnerships for the event window (0; +1) also confirm that average abnormal returns (AARs) differ across partnership types at a significance level of p < .05, with the marketing partnership sample reporting positive means and the technology partnership sample reporting negative means (Table W1, web appendix)",0,0.5182923674583435,0.4401514661909091
9YYy,"CCICog | exhibit | effects on | a respondent’sresistance to an organization’s repositioning (CCICogβ = .37 | CCICog (β) | **: p < .01,",0,0.4934645891189575,0.4222524491727273
9YDa,"The results in Table 4, Model 5 indicate a positive and significant association (p < 0.001) between performance decline and the risky investment of participants. | model coefficient = 1.342, standard error = 0.251",1,0.5051912665367126,0.7777843499909091
w5QP,"We also find support for H4, in that the effect of attitudinal loyalty on word of mouth (WOM) is stronger than the effect of behavioral loyalty on word of mouth (WOM) (β(attitudinal loyalty) = 0.41 vs. β(behavioral loyalty) = 0.19, chi squared(1) = 94.06)",1,0.515389084815979,0.7119784176636363
dXvX,"For the relationship of switching costs leading to switching: Number of effects (k) =  56. Total N = 18,505. Average r (variance weighted, corrected for reliability =  −.090*. 95% CI lower bound = −.162. 95% CI upper bound =  −.016. Q statistic for homogeneity (df) =  1,894.451 (56), p < 0.05.",0,0.5435572266578674,0.4564086422363636
yDyG,"As predicted, fit and similarity jointly affected participants’ intention to support the nonprofit (b = .10, p = .019) via clarity of positioning, as seen in Model B",0,0.502773106098175,0.3566587345090909
VvGD,"We compared if the difference in CAR between the joint announcement sample and the pure announcement sample is significant using a t-test. We find that the CARs are statistically significant at the p = .05 level. (Return window: [-2, 2], mean abnormal return = 1.03, % positive = 48, Patell t-statistic = 1.96, p = 0.05.",0,0.5424533486366272,0.3149853457363636
WE7Z,"The Corrado rank test offers strong statistical evidence of substantial negative returns for the day following the announcement day and depicts a real impact of sponsorship announcements on analysts’ forecasts. | Event day: +1 (after announcement), Abnormal Returns (AAR%) = -0.26, Corrado Rank Z Test = -2.99(a) | (a) signifies statistically significant at the 5% level.",0,0.5363971590995789,0.4247426368818182
1VbB,"SUFees rated the importance of financial benefits at a significantly higher level than their MUFees counterparts, F(1, 321) = 4.038, p = 0.000, eta squared = 0.243",1,0.5056933164596558,0.6320286554727271
Q1Ga,"the repeated measures ANOVA for the experimental group reveals significant increases in brand affect (F = 6.63, p < .01)",0,0.4767976701259613,0.4846983275000001
vR3L,"An increase in identity synergy, in turn, was related to increased perceptions of both organizational identification (β = .24, p < .01) | For the path Identity synergy → Organizational identification. hypothesis: H4, Std path coefficient =  0.24. t-value =  15.37",0,0.48647862672805786,0.4929853873272727
r8jd,"competitive intensity (beta = 0.34, t value = 2.61, p < 0.01) is positively related to market orientation implementation at the subsidiarities of global companies, in support of H2.",0,0.5196893215179443,0.4772336464818182
584w,"For innovativeness operationalization NPP newness: “Integrated innovator” mean = 5.33, Internally driven preserver =  3.43, Proactive customer-oriented innovator =  4.90, Top-down innovator =  4.67.  ANOVA p value =  .000.",1,0.5096456408500671,0.6165439164000001
Dl8D,"Hypothesis 1 receives general support because the relationship between the cultural values of stability and the business performance outcome are significantly greater for Japanese than for U.S. firms (the stable x national culture interaction on business performance was significant, model coefficient = 0.33, p ≤ 0.05)",0,0.5158582925796509,0.3815940417090909
7YXJ,"The results showed that the interaction between PBF and CBO was significant and positive (b = .045, t = 2.02, p < .05), which indicates that the positive impact of PBF on brand value gets stronger as CBO increases",0,0.5066692233085632,0.3162551863545455
Nj8V,"A 2 × 2 × 2 ANOVA revealedthe predicted three-way interaction on the difference scores(F(1, 201) = 9.94, p < .002), providing initial support for H2a",0,0.46624496579170227,0.4605502059000001
ze1L,"The one-way ANOVA revealed a significant effect [Mregret = 6.22 vs. Msatisfaction = 5.15,F(1,42) = 4.79, p < 0.05]. Thus, regretful forsakers were more likely to purchase a park ticket in the future than satisfied takers.",0,0.5164448022842407,0.3754277737181818
xmjb,"A statistically significant, unstandardized regression coefficient for the prime treatment variable = 1.767, SE = 0.596, p < .01",0,0.4759159982204437,0.4306399660090909
E2AP,"the effect of the two cortisol measurements being jointly significant for the female subsample, p = .028",0,0.47559210658073425,0.3386731164363637
NjKj,"an estimated Beta parameter = 0.053, SE = 0.012, p < .01",1,0.5140616297721863,0.6216936100818181
eR5K,"in a Wald test that shows that the coefficient of the β = 0.2 dummy is significantly greater than the coefficient for β = 0.1 (p < 0.01), confirming that workers’ effort increases with the level of CSR",0,0.5360310077667236,0.4589224135545454
AgO1,"rejection of the null: F(2,22)=7.93, p < .01",0,0.47516465187072754,0.5201237790636364
g3e9,"A statistically significant other-regarding preference parameter =  0.569 (standard error = 0.241), p < .05 - suggesting that social preferences play a significant role in determining investments in the game.",0,0.4809255003929138,0.44111236841818185
vRrw,"A significant difference between VCG and Knapsack according to the permutation test, p = .03",0,0.3833392560482025,0.42608207290909095
w5rW,"SCR amplitude measured before the decision is made has a marginal positive inﬂuence on evasion. The more subjects are emotionally aroused, the more they choose to evade. The marginal effect of one SCR point is 13.9% (note that SCR values are distributed between 0 and 2.24).  The unstandardized probit coefficient estimate for the SCR variable = .612,  SE = .351, p < .10",0,0.3278009295463562,0.2868369753454546
Ok5L,"A statistically significant difference between the English auction (87%) and the second price auction (63%), p < .01",1,0.4856583774089813,0.6658093407909091
Q1dl,"The WICS score explained 6% unique variance in older workers’ degree of positive contact with younger workers, F(1, 78) = 6.20, p < .015.",0,0.4556615948677063,0.4631427468454545
XP0K,"EWB predicts affective organizational commitment after accounting for the controls (β = .29, p < .01).",1,0.5143104791641235,0.5837378584090911
xm1O,"Job goals perceived by supervisors as exceedingly difficult were positively related to supervisor hindrance stress (β = .40, p < .05).",0,0.5117431282997131,0.4309397221636364
9Yqy,The standardized regression coefficient on the interaction between traumatic events and coping humor is -.25 with a p-value less than .01.,0,0.4818301796913147,0.4638895630454545
yD1Q,"A one-tailed test found found a significant three-way interaction of workload x performance feedback x racial distance, γ = -2.58, p < .05.",0,0.3841901421546936,0.3000936490272727
dXWX,"The authors find that the relationship between political skill and promotability differed between boss and direct report ratings [F (18, 488) = 2.70, p < 0.01, two-tailed]. Per Table 2, the intercept is higher and slope is stronger for boss ratings than direct report ratings.",0,0.4893282651901245,0.4408853303545455
E25r,"Following a significant interaction of mean age and age diversity, simple slopes analyses revealed that the effect of mean age was eight times larger when there was less as opposed to more age diversity in store units (unstandardized effect of mean age when there's less age diversity = -0.08, p < 0.01).",1,0.4712209701538086,0.5377962920181818
w5dv,"The ANOVA demonstrated that satisficers, free agents, and maximizers varied in their preference for part-time work (F(2, 148) = 5.46, p < 0.01).",1,0.480593740940094,0.6015503577818182
