0Wea,"The chi square test comparing the recommendations of teachers and clinicians evaluating the same child was significant, Chi squared (4) = 114.85, p < .001. Of the children recommended by the clinician for referral, 86% received the same recommendation by the teacher, and of the children recommended for no further follow-up by the clinician, 94% were given the same recommendation by the teacher.",1,0.5713684558868408,0.848177622481818
gRWz,"Gay and bisexual participants reported significantly greater desire for toned and defined muscles than completely heterosexual participants (beta = .39, 95% C.I. = .21, .57).",0,0.5209579467773438,0.5
74r9,"When tested simultaneously, and while controlling for receipt of public assistance, race, odds ratio (OR) = 1.61, 95% confidence interval (CI) [1.32–1,96], p < .001, was a significant predictor of initiation (see Results section for which variables were included in this analysis).",0,0.5487673282623291,0.5
BaZX,"The result was a statistically significant coefficient for the PICTS score - Wald = 7.96, p < .05 exp(B) = 1.49, 95% CI(1.13 – 1.96), power as calculated with formulae from Hsieh & Lavori (2000) =   .791.",0,0.5112872123718262,0.3684395302090909
OW0b,"The result support a positive indirect effect, which is confirmed with the method from Muthén and Asparouhov (2015; table 4: B = .031, p < .05)",0,0.569966197013855,0.3641179448999999
RjXk,"the interaction effect between target size and incentive (Model 3), which was positive and significant (gamma = 9.23, p < .01,delta R squared = 0.04)",0,0.4655976891517639,0.3900984876454545
AEaG,"Alienation in teacher–student relationships contributed significantly to life satisfaction (Beta = -.20, t = –3.02, p = .003), accounting for 2.66% unique variance in the model and indicating that students with greater levels of alienation in relationships with teachers had lower life satisfaction scores.",0,0.552639365196228,0.44156365299090905
VYee,"There was a significant, positive interaction effect between condition and posttest scores for students with LD, such that adjusted posttest means were higher for students with LD who received CSR in general education classrooms than for students with LD who did not receive CSR (beta = 4.86, p = .03). It is estimated that students with LD score an average of 4.86 points higher on the GMRT when in a class implementing CSR, compared to students with LD who received typical instruction. This difference is equivalent to a Hedges’s g effect size of 0.52.",0,0.5477229952812195,0.31301866647272725
JWzJ,"The result was a statistically significant coefficient n the Some College x Period interaction term, b = -.725, SE = .27, p < .01",1,0.5599104762077332,0.5518275694454546
5Kgq,"When the authors include country-region fixed effects so that identification comes from change in HIV prevalence within a region over time, they find that higher HIV prevalence is associated with a significantly lower probability of reporting antenatal care, b = -1.734, SE = .074, SE[corrected for clustering at the region level] = .331.",1,0.5506802797317505,0.7934280656090908
gR3Q,"Childhood SES was inversely associated with HR at recovery, adjusting for age, race, marital status, BMI, current smoking, current SES, and average task demand: HR, beta = -.14, t(230) = 2.05, p = .042.",0,0.5086226463317871,0.2661411674090909
Dq1Y,"The authors find that FIRCs following interstate wars make civil war onset significantly more likely (coefficient on FIRC/Lose War term = 2.13 (0.577), significant at the 0.001 level [one-tailed]).",1,0.5423274636268616,0.7832247723000001
8VbW,"The approach used in the modular condition was rated significantly higher than the approach in the UC condition (Modular vs. UC: Estimate = 2.45, SE = 0.78, p = .003; statistically significant at alpha = .05; parameter estimates represent the model-predicted difference in scale scores for the pairwise contrast in question, with the latter group as the reference; df = 68 for all pairwise tests).",0,0.5089433789253235,0.5176228516090909
5ELB,"The specific indirect effect of PB in the behavioral conduct domain was significant (p < .05; 95% CI [.01, .12]).",0,0.5168212652206421,0.2622093984272727
aYe3,"mean accuracy levels significantly exceeded chance for most leadership category pairings. In other words, we found that participants could identify the domains that leaders belong to just by looking at their faces (specifically, see the “business-politics” pairing reported in Figure 2).",0,0.5080650448799133,0.30069694001818176
1DLv,"leaders’ workplace alcohol consumption was positively related to abusive supervision (beta = .122, p < .01)",1,0.5558862686157227,0.5617456666727273
5Kw3,"The result was a statistically significant relative risk ratio (RRR) = 1.85, p < .001",1,0.5710299611091614,0.8755301335636364
R5vL,"Table 1 provides the null and two additional models showing that homogeneity of knowledge is related to knowledge acquisition, b = -0.560, SE = 0.22, p < .01 (see Model 2).",0,0.552788496017456,0.44854325519090893
lrBy,"The Motivational Interviewing Skill Code identifies proportion measures that can be interpreted in relation to MI proficiency benchmarks. Analyses of these measures showed proportion MI consistent skills was positively associated with proportion change talk (r = .11, 95% CI [.03, .18]; p = .004, k = 22, Q statistic < .05, I^2 [percentile estimate of between-study variance] = 55%).",0,0.5311188697814941,0.5070619046909091
9Aqq,"There was a significant moderation effect for the relation among intervention assignment, depression scores at postintervention, and craving scores at 2 months (beta = -.32, p = .001, f^2 = 0.21).",1,0.5259144306182861,0.6607045106272726
VeWE,"Change talk predicted drinking status at Week 5, with more change talk associated with fewer drinks per week (from Table 4, Intercept of DW -- CT: Coeff = -0.024, SE = 0.001, Event rate ratio = 0.976, 95% CI = [0.995, 0.977], t ratio = -34.548, p < .01).",1,0.4485774040222168,0.7530260616363638
2Ypg,"Model 3 of table 4 substitutes the contemporaneous measure of immigrant population concentration with the point-of-entry measure of imm-grant population concentration. The point-of-entry effect on earnings and earnings growth is positive and statistically significant. The effect of entering a local labor market that is one percentage point more concentrated with foreign-born population translates into about 0.6% increase in earnings at age 40 (Beta = .563, SE = .103, P < .001).",1,0.5708056092262268,0.7817874497363636
ODVO,"Model 7 jointly examines the various types of associations examined in models 1–6. This summary analysis shows that progressive political groups is a key associational predictor of BORDC passage nationwide, b = 10.89, SE = 2.87), p < .001.",1,0.511337399482727,0.7632072994818183
vQdG,"There is a predictive relationship between English proficiency and whether the student’s highest class level was an honors class, Beta_C = 0.03, p < 0.001. For every one-unit gain in English proficiency level, ELs are 3 percentage points more likely to have an honors class as their highest level class.This means that a Level 5 EL is 12 percentage points more likely to have an honors level class as their highest level class compared to a Level 1 EL with the same prior achievement in the same school.",1,0.5549274682998657,0.7320585049818181
xjpP,"Students who stated that they did not wish to obtain a certificate were more likely to drop out than those who did intend to obtain a certificate of completion, B = .208, Wald = 5.70, Exp(B) = 1.23, p < 0.001",1,0.5963106155395508,0.8461667469545454
Qj2l,"An ANOVA on student responses to skill IV questions yielded a main effect of format, such that students did much better when the evolutionary relationships were depicted on a tree than a ladder (M = .43 vs. M = .27, respectively, p < .001, partial eta squared = .34)",1,0.5570261478424072,0.7410784203727272
5v4m,"Participants in the add-1 interventions had significantly greater gains in fluency than those in the active control group with unpracticed n + 1 or 1 + n items at delayed post-test, F(1, 61) = 3.53, p = 0.033, d = .50",0,0.5396373271942139,0.2754186120454545
QjYP,"Results of hierarchical regression analysis (see Table 3) indicated that bravery (b = 1.80, p < 0.01) had a positive relationship with boss- or board member-rated executive performance.",0,0.5561646819114685,0.5251588641
bYxk,"The Sobel test indicated a significant reduction for the leader expressing sadness (Z = − 2.46, p < .01)",0,0.4956347346305847,0.3784295514090909
9w3Z,"Results in Table 3 reveal a significant interaction between transformational leadership (counts) and team type in predicting team task performance, supporting the hypothesis.  From Table 3: interaction coefficient = 0.34, p < 0.05.",0,0.48803475499153137,0.29897993975454545
pGQ4,"In the fourth model in Table 4, the authors include all control variables; time-invariant variables are omitted because of the nature of the FE model. As in the OLS model, including the control variables causes the coefficient on residential-neighborhood exposure to decrease to almost one-half that in Model 3, b = .031, SE = .008, p < .01.",0,0.5682992339134216,0.5079686625090909
KZNd,"A mixed effects regression model showed the Mom-Net group had a significantly lower posttest adjusted PHQ-9 (estimate = -1.51, t = -2.44, p = .015, d = .27) score compared with MIRS [Motivational Interview and Referral to Services] participants (Bonferroni-corrected p = .05/2 = .025).",0,0.5270847678184509,0.4279278294727273
RXjv,"Lower (vs. higher) risk responders were significantly less likely to relapse within 8 months, 2 of 49 vs. 43 of 241; chi-square(1) = 6.83, p < .01, R^2 = .023. Kaplan–Meier (KM) estimates were 4.9% for lower risk and 22.1% for higher risk responders (see Figure 2 and Table 3).",1,0.5241118669509888,0.5307185148363637
9AbX,"Comparing the deviance statistic between Model D and the baseline model (Model A) revealed a significant improvement in model fit and a significant fixed effects estimate for COG (fixed effects estimate for COG: -0.023, p < .001) [the significant fixed effects estimate is the result selected for the SCORE program]. These findings suggest that the CGI-S outcome trajectory does indeed display a linear discontinuity in slope post-COG.",1,0.5718520879745483,0.7195736300454546
0Y0l,"A Time x Condition interaction indicated that there were significantly greater pre-to-post reductions for eBody Project participants versus brochure controls for body dissatisfaction (d = 1.32, p = .000 [Table 2]; from Table 1: eBody Project pretest M, SD = 3.23, 0.56; posttest M, SD = 2.78, 0.78; brochure controls pretest M, SD = 3.26, 0.65; posttest M, SD = 3.33, 0.66).",1,0.5321871638298035,0.6857445082454546
5EeE,"Overall, early alliance was associated with PE homework adherence (r = .32, p < .05).",0,0.534814715385437,0.3578261327090909
WVWe,"Co-operation exerts a positive influence on mediation effectiveness, and the variable is statistically significant (estimate for Co-operation = 2.318, clustered robust SE = 0.645, significant at 1 per cent [two-tailed]).",1,0.5210446715354919,0.7547474872
7O9P,"The percent rural measure is significant in model 1 (estimate for %rural term = -1.301, robust SE = 0.398, p < .01 [two-tailed test]).",1,0.5467795133590698,0.5319783484545455
X0Yz,"The positive and significant coefficient estimate for the interaction term indicates that the effect of contact differs significantly for leftists (Democrats) and rightists (Republicans) (from Column 2 in Table 2: linear regression coefficient for 'Contact x Rightist' term = 0.40; SE = 0.14; p < .01, two-tailed test).",1,0.47394680976867676,0.5272258676
V02V,"As can be seen from Figure 3, coethnic candidates were rated much more favorably than non-coethnic candidates. The 95% confidence intervals around the mean ratings for coethnics and non-coethnics do not overlap. This implies that respondents took the ethnicity of candidates into account.",1,0.5838817358016968,0.8301586024363637
J07B,"When regressing the variables on conciliatory attitudes, hope (beta [standardized regression coefficient] = .13, p = .03, SE = .06) became the stronger and more proximal predictor.",0,0.48132047057151794,0.33824416528181817
edLQ,The authors find that primary education is positively associated with terrorism (from column 6: estimate for Primary education t-1 = 0.069; robust absolute z value clustered on countries = 2.86; significant at 1 percent level).,0,0.5764138698577881,0.5043016498909091
epXm,"The first column in Table 3 shows that the gender effect on distance persists in a model with individual and family controls: the odds of living in farther distance categories from parents at age 34 is 16 % larger for females than for males, OR = 1.164, SE = .010, significant at 1 %.",1,0.5529142618179321,0.5599785562181818
QGrm,"The result was a statistically significant coefficient on the Localized concentrated disadvantage dummy variable, b = 1.528, SE = .645, p < .05 (two-tailed).",0,0.5569822788238525,0.3755739337727272
P8OJ,"planned contrast analysis showed that when participants imagined weak past performance, a performance reset increased self-eﬃcacy (M = 5.63, SD = 1.84) relative to the control condition (M = 4.35,SD = 2.12), F(1, 357) = 22.05, p < 0.0001, 95% CIdiﬀerence = [0.69,1.87], d = 0.64",1,0.5415341258049011,0.7976866815181818
W4VN,"The analyses revealed a significant main effect of Task A framing on the number of editorial mistakes identified (F(1, = 6.79, p < 0.05, eta squared = 0.09.",0,0.4981067478656769,0.34688674076363635
ERKZ,"The authors find that a smaller percentage of learners in the HIV/STI risk-reduction intervention schools reported having unprotected vaginal sex averaged over the postintervention period compared with their counterparts in control schools (d = 0.15), controlling for baseline unprotected vaginal sex (see Table 3, OR = 0.42, 95% CI = 0.22, 0.84, p = .013).",0,0.5050806403160095,0.5
Bk5g,"As reported in Table 5, in salient cases, black male judges are 43% less likely, than white male judges, to receive the majority opinion–writing assignment p < .05, one-tailed, in hypothesized direction.",0,0.574266254901886,0.4908146308818182
kNrP,The coefficient on the ability to communicate indicator is -2.58 with a standard error of 0.524 and a p-value less than 0.01.,1,0.5061920285224915,0.6072775728
pYXm,"Adjusting for covariates, the regression coefficient on the five mailings indicator variable is 0.0156 with a standard error of 0.0051.",0,0.42263805866241455,0.4475868349727273
G4mp,The coefficient on the create 1000 local jobs term in the model is approximately 0.25 with a 95% confidence interval that does not contain 0.,1,0.5380071997642517,0.839206159109091
bw79,The coefficient on the indicator variable for current law not granting the right is -0.08 with a standard error of 0.01 and a p-value below 0.01.,1,0.5328604578971863,0.6759555928636364
qND2,The coefficient on the untrue condition indicator is -2.38 with a standard error of 1.12 and a p-value below 0.05.,0,0.4821520745754242,0.3860393781000001
kNgP,The coefficient on the treatment indicator is 0.390 with a standard error of 0.107 and a p-value less than 0.001 [this information is found in the online appendix: https://static.cambridge.org/resource/id/urn:cambridge.org:id:binary:20161006204143783-0271:S2052263014000207:S2052263014000207sup001.pdf].,1,0.4812122583389282,0.7647885778181819
zKgY,The difference in effect estimates between the YouGov and MTurk samples is -0.85 with a p-value of 0.02 [these results are found in the corrections posted online].,0,0.4954383373260498,0.3993813429545454
9xZY,"Table 2 shows that mother's asset ownership is positively and significantly associated with children's HAZ scores: as the asset index rises by one point, the average HAZ score increases by 0.10 points (OLS estimate on PCA asset index term = 0.101, SE clustered at household level = 0.051, p < 0.05).",0,0.570552408695221,0.3815904924545455
JK7Q,"In race-stratified, fully-adjusted logistic regression models (Table 2), African-Americans reporting SES discrimination were significantly more likely to have poor sleep quality (PSQI scores 5 and greater) than African-Americans not reporting SES discrimination (OR = 2.32, 95% Confidence Interval [CI] = 1.14-4.72).",0,0.5382772088050842,0.30207616703636364
wWZ7,"The results suggest that changes in economic conditions have a statistically significant impact on physician migration. A one percentage point decrease in last year’s growth increases physician migration this year by approximately .3 percent (from Table 4: estimate for Growth (t-1) term = -.0032, SE clustered at country level = .0016, p < .05).",0,0.5595582127571106,0.3888913584727272
4zev,"After adjusting for demographic variables, linear regression models indicated a significant change in the level of children’s psychological symptoms. When comparing pre- versus post-intervention assessment, the authors observed a significant change in the level of the children’s self-report of psychological symptoms (beta = 3.42; SE = 0.54; p < 0.0001).",1,0.4949275851249695,0.8293104146363635
qVDw,"The significant procyclical pattern for the working age population appears to be driven by those age 30-39, with results significant for both men and women in their 30s (estimate of the effect of unemployment for age 30-34 = -0.0188, robust SE (clustered at the province level) = 0.0071, 5% level of significance).",0,0.5613514184951782,0.32452572391818185
kjg2,"The Odds Ratio increases dramatically in accordance to the increase in the number of risk behaviors (adjusted odds ratio (95% confidence interval) for Jewish Israeli sample with 4 health risk behaviors = 13 (5.7, 29.6)).",1,0.5310134291648865,0.8302758516636363
pB7j,"When controls for CAs were added to the model, parental education continued to predict disorder severity for all disorder classes, such that the disorders of respondents whose parents had less than a college education were most likely to be severe (chi-squared_3 = 13.1 [see 'any mood' column], significant at the 0.05 level [two-sided test]).",0,0.5405312776565552,0.3781883311090909
E8zN,"A negative association with the “weak not sick” outcome variable was observed for the label “depression” for the depression vignette (OR = 0.29, 95% CI = 0.21-0.40, p < 0.001).",1,0.5506543517112732,0.7801741033090909
POdb,"Regarding all-cause mortality, Model 1 in Table 2 indicates that the odds of dying for people who reported being ‘often’ lonely were 1.63 times as high as those for people who reported being ‘never’ lonely, controlling for age and gender (OR = 1.63, [95% CI] = [1.25-2.13], p < 0.001).",1,0.5471416711807251,0.8346979829545454
5vDm,"Controlling for grade, gender, subject, and peer belonging (Model D), connective instruction was positively related to engagement; when two classes differed by a standard deviation on connective instruction, students found the class with more connective instruction to be .59 standard deviations higher on engagement (p < .05).",0,0.5662537813186646,0.4104580100181818
BlNQ,Table VIII estimates younger sister effects on...school enrollment...among women aged 15–19. A younger sister...decreases her probability of attending school in the previous year by 6.5 percentage points.[The coefficient for “Younger sister” in Table VIII is -0.067 with standard errors clustered at the PSU level of 0.024.],0,0.5579515695571899,0.5157458213
EZej,"The first lag of terrorism incidence is significantly associated with lower levels of female labor force participation with a 99 percent statistical confidence level (from Table 2: b/se for Terrorist attacks (t - 1) term = -0.004 (0.001), significance level at which the null hypothesis is rejected = 1 percent).",0,0.5464709997177124,0.4660729300636364
jRbQ,"Contract incompleteness, as measured by difficulty, increases in the number of participants (from Table 5: Coefficient on 'Log(number participating states)' term = -0.130, significant at 1 percent; SE robust to heteroscedasticity = 0.019; p value = .000; 95 percent confidence interval = [-0.167, -0.093]).",1,0.5588869452476501,0.7985463001545455
OylL,"…when [the author] regresses the negative of the log of fertility per 100,000 people on log GDP per capita, the coefficient on log GDP per capita is a very significant 0.371 (std. err. = 0.087)...",1,0.5540585517883301,0.8210310487727274
OygL,"Table III presents [the] main OLS results for city growth. Column (1) controls only for initial population, showing that subscriber density is strongly positively associated with city growth over the period 1750–1850. The coefficient of “Subs. density” is 0.100, p<0.05, standard error of 0.039.",0,0.5843368172645569,0.4512753385818182
9wkl,"Consistent with earlier analyses, we find that union victories are associated with CARs that are 12.1 percentage points lower than firms with union losses (t-ratio = − 3.5). [Coefficient of “Union Victory” is -0.121 with robust standard errors of 0.035.]",1,0.5876287817955017,0.801121171281818
VLVA,"Column (1) focuses on customers with a prior Test Item purchase. For these customers beta_1 is negative and significant, indicating that for [the] benchmark customer (for whom Time equals zero) the deep discounts led to a 7.8% reduction in post-test sales [In Table IV, Column 1: coefficient for ""Deep Discount"" is -0.078, asymptotic standard errors = 0.020]",1,0.5837699174880981,0.6614973742636363
2vB7,"The results in columns (2), (4), and (6), based on the 75th percentile indicator, provide stronger support. Each is statistically significantly different from zero at the 95% confidence level, and the magnitudes seem plausible… Estimates for total revenue per capita (column(2)) indicate that a community with so few (population-weighted) other local governments in its metropolitan area as to put it in the top quartile of our Herfindahl index for this constraint proxy raises nearly 9% more revenue if it barely elected a Democrat as its mayor than otherwise similar cities that also barely elected aDemocrat but have Herfindahl values below the 75th percentile cutoff. [The coefficient for “Dummy for high Herfindahl index” is 0.088 with standard error clustered by city and decade of 0.042.]",0,0.5683756470680237,0.3715097063636364
V5dV,"Table 6 presents results for enrollment in the state’s public postsecondary institutions...GED certification is associated with a statistically significant increase in the likelihood of postsecondary attendance for the first five quarters after the initial GED attempt. The effect size is 8 percentage points in the first quarter after the test…[The coefficient for ""Quarters since 1st GED test = 1” is 0.081 with a standard error of 0.012, significant at the 5% level.]",1,0.5343940258026123,0.8210313722363636
q8DZ,"[Column 1,] panel B of table 2 reports a large and statistically significant coefficient on the after-reform trend variable indicating an average 6–7 percent decline in the consumption-income gap per year from 2001 to 2004. [The coefficient for “After-reform trend (2001 = 1)” is -0.067 with robust standard errors of 0.005, statistically significant at 1%.]",1,0.5659764409065247,0.7870110314727273
GOAw,Table 4 reports the estimated probabilities of occupying the six observable earnings and welfare participation states under each policy regime in the seven quarters after random assignment. Coefficient for the difference in Pr(State=1n) between Jobs First and AFDC is -0.048 with a standard error of 0.006.,1,0.6274248361587524,0.8175704040272728
4ZGV,Panel A shows that passive investors... differ greatly in labor income…[Coefficient of “Labor income” is 0.146 with robust standard errors of 0.005.],1,0.5943230390548706,0.8107935473272728
8VXd,"Table V reports the results from [the] regression. As shown, changes in the marginal tax rate are significantly and positively related to stock market returns. [The coefficient for “S&P 500 return” is 0.70723 with a t-Statistic of 3.01.]",1,0.5568833351135254,0.5600628696090909
5Ebl,"Panel B of Table IV demonstrates that firms with high EDF scores and low R&D expenditures experience strong momentum in stock returns…[Coefficient for “Low” for “W-L” under “High EDF” is 2.00, with a t-stat 4.57.]",1,0.5747471451759338,0.7689867696909091
AYQG,"Focusing on the coefficient for the interaction term, the authors find that the coefficient is negative and significant at a conservative level. In the case of sociotropic economic evaluations, having a positive view of the overall economic situation of the country is strongly associated with supporting the incumbent governor or her party in multiparty regimes, but appears virtually unrelated to voting for the incumbent in dominant-party systems (Model 1: coefficient on 'Dominant party × Sociotropic' term = −0.011; SE = 0.005; p < .05).",0,0.5596084594726562,0.3624290250090909
aBp3,"Autocratic linkage in the trade linkage dimension significantly reduces the risk of autocratic breakdown, as can be seen from the negative and significant coefficient of autocratic linkage by trade (from the 'Trade (mean)' column of Table 1: Cox regression coefficient for 'Autocratic linkage' term = −1.576; robust SE clustered by country = 0.485; p < .01).",1,0.55488121509552,0.5433134607727272
O01m,Modernization has the expected effect on the DC slope. A one standard deviation increase in the rate of modernization generates a .55 decrease in the slope of the DC vote (from Table 1 (Model 1 Standardized Weights): Est for DC 1953–1992 SLOPE ← MODERNIZATION Directed relationship = –.550; p = Significance < .000).,1,0.5523144006729126,0.7594470572363637
